21:42:39.872785 IP 192.168.137.215.46650 > 192.168.137.1.12000: Flags [S], seq 3450988633, win 64240, options [mss 1460,sackOK,TS val 594431405 ecr 0,nop,wscale 7], length 0
21:42:39.881376 IP 192.168.137.1.12000 > 192.168.137.215.46650: Flags [S.], seq 143125803, ack 3450988634, win 65535, options [mss 1460,nop,wscale 8,nop,nop,sackOK], length 0
21:42:39.881408 IP 192.168.137.215.46650 > 192.168.137.1.12000: Flags [.], ack 1, win 502, length 0
21:42:39.881486 IP 192.168.137.215.46650 > 192.168.137.1.12000: Flags [.], seq 1:1461, ack 1, win 502, length 1460
21:42:39.881496 IP 192.168.137.215.46650 > 192.168.137.1.12000: Flags [.], seq 1461:2921, ack 1, win 502, length 1460
21:42:39.881499 IP 192.168.137.215.46650 > 192.168.137.1.12000: Flags [P.], seq 2921:4097, ack 1, win 502, length 1176
21:42:39.881522 IP 192.168.137.215.46650 > 192.168.137.1.12000: Flags [.], seq 4097:5557, ack 1, win 502, length 1460
21:42:39.881526 IP 192.168.137.215.46650 > 192.168.137.1.12000: Flags [.], seq 5557:7017, ack 1, win 502, length 1460
21:42:39.881529 IP 192.168.137.215.46650 > 192.168.137.1.12000: Flags [.], seq 7017:8477, ack 1, win 502, length 1460
21:42:39.881531 IP 192.168.137.215.46650 > 192.168.137.1.12000: Flags [.], seq 8477:9937, ack 1, win 502, length 1460
21:42:39.881534 IP 192.168.137.215.46650 > 192.168.137.1.12000: Flags [P.], seq 9937:11397, ack 1, win 502, length 1460
21:42:39.881565 IP 192.168.137.215.46650 > 192.168.137.1.12000: Flags [.], seq 11397:12857, ack 1, win 502, length 1460
21:42:39.881569 IP 192.168.137.215.46650 > 192.168.137.1.12000: Flags [P.], seq 12857:14317, ack 1, win 502, length 1460
21:42:39.908752 IP 192.168.137.215.46650 > 192.168.137.1.12000: Flags [.], seq 14317:15777, ack 1, win 502, length 1460
21:42:39.978966 IP 192.168.137.1.12000 > 192.168.137.215.46650: Flags [P.], seq 1:1025, ack 1461, win 256, length 1024
21:42:39.979048 IP 192.168.137.215.46650 > 192.168.137.1.12000: Flags [.], ack 1025, win 494, length 0
21:42:39.979093 IP 192.168.137.1.12000 > 192.168.137.215.46650: Flags [P.], seq 1025:1461, ack 2921, win 256, length 436
21:42:39.979118 IP 192.168.137.215.46650 > 192.168.137.1.12000: Flags [.], ack 1461, win 491, length 0
21:42:39.979151 IP 192.168.137.1.12000 > 192.168.137.215.46650: Flags [P.], seq 1461:2921, ack 2921, win 256, length 1460
21:42:39.979172 IP 192.168.137.215.46650 > 192.168.137.1.12000: Flags [.], ack 2921, win 480, length 0
21:42:39.979190 IP 192.168.137.1.12000 > 192.168.137.215.46650: Flags [P.], seq 2921:4097, ack 5557, win 256, length 1176
21:42:39.979213 IP 192.168.137.215.46650 > 192.168.137.1.12000: Flags [.], ack 4097, win 471, length 0
21:42:39.979236 IP 192.168.137.1.12000 > 192.168.137.215.46650: Flags [P.], seq 4097:5557, ack 5557, win 256, length 1460
21:42:39.979252 IP 192.168.137.215.46650 > 192.168.137.1.12000: Flags [.], ack 5557, win 460, length 0
21:42:39.979269 IP 192.168.137.1.12000 > 192.168.137.215.46650: Flags [.], ack 7017, win 256, length 0
21:42:39.979278 IP 192.168.137.1.12000 > 192.168.137.215.46650: Flags [P.], seq 5557:7017, ack 7017, win 256, length 1460
21:42:39.979323 IP 192.168.137.215.46650 > 192.168.137.1.12000: Flags [.], ack 7017, win 449, length 0
21:42:40.020974 IP 192.168.137.215.46650 > 192.168.137.1.12000: Flags [.], seq 15777:17237, ack 7017, win 501, length 1460
21:42:40.021041 IP 192.168.137.215.46650 > 192.168.137.1.12000: Flags [.], seq 17237:18697, ack 7017, win 501, length 1460
21:42:40.021054 IP 192.168.137.215.46650 > 192.168.137.1.12000: Flags [.], seq 18697:20157, ack 7017, win 501, length 1460
21:42:40.021063 IP 192.168.137.215.46650 > 192.168.137.1.12000: Flags [.], seq 20157:21617, ack 7017, win 501, length 1460
21:42:40.021073 IP 192.168.137.215.46650 > 192.168.137.1.12000: Flags [.], seq 21617:23077, ack 7017, win 501, length 1460
21:42:40.021083 IP 192.168.137.215.46650 > 192.168.137.1.12000: Flags [P.], seq 23077:24537, ack 7017, win 501, length 1460
21:42:40.064613 IP 192.168.137.1.12000 > 192.168.137.215.46650: Flags [.], ack 8477, win 256, length 0
21:42:40.064653 IP 192.168.137.1.12000 > 192.168.137.215.46650: Flags [P.], seq 7017:8477, ack 8477, win 256, length 1460
21:42:40.064707 IP 192.168.137.215.46650 > 192.168.137.1.12000: Flags [.], ack 8477, win 493, length 0
21:42:40.064749 IP 192.168.137.1.12000 > 192.168.137.215.46650: Flags [.], ack 9937, win 256, length 0
21:42:40.064765 IP 192.168.137.1.12000 > 192.168.137.215.46650: Flags [P.], seq 8477:9937, ack 9937, win 256, length 1460
21:42:40.064783 IP 192.168.137.215.46650 > 192.168.137.1.12000: Flags [.], ack 9937, win 482, length 0
21:42:40.064812 IP 192.168.137.1.12000 > 192.168.137.215.46650: Flags [.], ack 11397, win 256, length 0
21:42:40.064828 IP 192.168.137.1.12000 > 192.168.137.215.46650: Flags [P.], seq 9937:11397, ack 11397, win 256, length 1460
21:42:40.064836 IP 192.168.137.1.12000 > 192.168.137.215.46650: Flags [.], ack 12857, win 256, length 0
21:42:40.064843 IP 192.168.137.1.12000 > 192.168.137.215.46650: Flags [P.], seq 11397:12857, ack 12857, win 256, length 1460
21:42:40.064872 IP 192.168.137.215.46650 > 192.168.137.1.12000: Flags [.], ack 11397, win 471, length 0
21:42:40.064893 IP 192.168.137.1.12000 > 192.168.137.215.46650: Flags [.], ack 14317, win 256, length 0
21:42:40.064945 IP 192.168.137.215.46650 > 192.168.137.1.12000: Flags [.], ack 12857, win 460, length 0
21:42:40.064982 IP 192.168.137.1.12000 > 192.168.137.215.46650: Flags [P.], seq 12857:14317, ack 14317, win 256, length 1460
21:42:40.065005 IP 192.168.137.1.12000 > 192.168.137.215.46650: Flags [.], ack 15777, win 256, length 0
21:42:40.065012 IP 192.168.137.1.12000 > 192.168.137.215.46650: Flags [P.], seq 14317:15777, ack 15777, win 256, length 1460
21:42:40.065250 IP 192.168.137.215.46650 > 192.168.137.1.12000: Flags [.], ack 15777, win 445, length 0
21:42:40.093285 IP 192.168.137.215.46650 > 192.168.137.1.12000: Flags [.], seq 24537:25997, ack 15777, win 501, length 1460
21:42:40.093315 IP 192.168.137.215.46650 > 192.168.137.1.12000: Flags [P.], seq 25997:27457, ack 15777, win 501, length 1460
21:42:40.101167 IP 192.168.137.1.12000 > 192.168.137.215.46650: Flags [.], ack 17237, win 256, length 0
21:42:40.101204 IP 192.168.137.1.12000 > 192.168.137.215.46650: Flags [P.], seq 15777:17237, ack 17237, win 256, length 1460
21:42:40.101241 IP 192.168.137.1.12000 > 192.168.137.215.46650: Flags [.], ack 18697, win 256, length 0
21:42:40.101255 IP 192.168.137.1.12000 > 192.168.137.215.46650: Flags [P.], seq 17237:18697, ack 18697, win 256, length 1460
21:42:40.101266 IP 192.168.137.1.12000 > 192.168.137.215.46650: Flags [.], ack 20157, win 256, length 0
21:42:40.101374 IP 192.168.137.215.46650 > 192.168.137.1.12000: Flags [.], ack 18697, win 501, length 0
21:42:40.136864 IP 192.168.137.215.46650 > 192.168.137.1.12000: Flags [.], seq 27457:28917, ack 18697, win 501, length 1460
21:42:40.136927 IP 192.168.137.215.46650 > 192.168.137.1.12000: Flags [.], seq 28917:30377, ack 18697, win 501, length 1460
21:42:40.136940 IP 192.168.137.215.46650 > 192.168.137.1.12000: Flags [.], seq 30377:31837, ack 18697, win 501, length 1460
21:42:40.136950 IP 192.168.137.215.46650 > 192.168.137.1.12000: Flags [P.], seq 31837:33297, ack 18697, win 501, length 1460
21:42:40.144916 IP 192.168.137.215.46650 > 192.168.137.1.12000: Flags [.], seq 33297:34757, ack 18697, win 501, length 1460
21:42:40.144951 IP 192.168.137.215.46650 > 192.168.137.1.12000: Flags [.], seq 34757:36217, ack 18697, win 501, length 1460
21:42:40.144962 IP 192.168.137.215.46650 > 192.168.137.1.12000: Flags [P.], seq 36217:37677, ack 18697, win 501, length 1460
21:42:40.150734 IP 192.168.137.1.12000 > 192.168.137.215.46650: Flags [P.], seq 18697:20157, ack 20157, win 256, length 1460
21:42:40.150791 IP 192.168.137.1.12000 > 192.168.137.215.46650: Flags [.], ack 21617, win 256, length 0
21:42:40.150812 IP 192.168.137.1.12000 > 192.168.137.215.46650: Flags [P.], seq 20157:21617, ack 21617, win 256, length 1460
21:42:40.150827 IP 192.168.137.1.12000 > 192.168.137.215.46650: Flags [.], ack 23077, win 256, length 0
21:42:40.150838 IP 192.168.137.1.12000 > 192.168.137.215.46650: Flags [P.], seq 21617:23077, ack 23077, win 256, length 1460
21:42:40.150852 IP 192.168.137.1.12000 > 192.168.137.215.46650: Flags [.], ack 23077, win 256, options [nop,nop,sack 1 {24537:25997}], length 0
21:42:40.150892 IP 192.168.137.1.12000 > 192.168.137.215.46650: Flags [.], ack 23077, win 256, options [nop,nop,sack 1 {24537:27457}], length 0
21:42:40.157589 IP 192.168.137.215.46650 > 192.168.137.1.12000: Flags [.], seq 23077:24537, ack 23077, win 467, length 1460
21:42:40.174910 IP 192.168.137.1.12000 > 192.168.137.215.46650: Flags [.], ack 23077, win 256, options [nop,nop,sack 1 {24537:28917}], length 0
21:42:40.174979 IP 192.168.137.215.46650 > 192.168.137.1.12000: Flags [.], seq 37677:39137, ack 23077, win 467, length 1460
21:42:40.175034 IP 192.168.137.1.12000 > 192.168.137.215.46650: Flags [.], ack 23077, win 256, options [nop,nop,sack 1 {24537:30377}], length 0
21:42:40.175065 IP 192.168.137.215.46650 > 192.168.137.1.12000: Flags [.], seq 39137:40597, ack 23077, win 467, length 1460
21:42:40.175086 IP 192.168.137.1.12000 > 192.168.137.215.46650: Flags [.], ack 23077, win 256, options [nop,nop,sack 1 {24537:31837}], length 0
21:42:40.175101 IP 192.168.137.1.12000 > 192.168.137.215.46650: Flags [.], ack 23077, win 256, options [nop,nop,sack 1 {24537:33297}], length 0
21:42:40.175117 IP 192.168.137.1.12000 > 192.168.137.215.46650: Flags [.], ack 23077, win 256, options [nop,nop,sack 1 {24537:34757}], length 0
21:42:40.175130 IP 192.168.137.1.12000 > 192.168.137.215.46650: Flags [.], ack 23077, win 256, options [nop,nop,sack 1 {24537:36217}], length 0
21:42:40.175143 IP 192.168.137.1.12000 > 192.168.137.215.46650: Flags [.], ack 23077, win 256, options [nop,nop,sack 1 {24537:37677}], length 0
21:42:40.175232 IP 192.168.137.1.12000 > 192.168.137.215.46650: Flags [.], ack 37677, win 256, length 0
21:42:40.176379 IP 192.168.137.215.46650 > 192.168.137.1.12000: Flags [.], seq 40597:42057, ack 23077, win 467, length 1460
21:42:40.176428 IP 192.168.137.215.46650 > 192.168.137.1.12000: Flags [.], seq 42057:43517, ack 23077, win 467, length 1460
21:42:40.176441 IP 192.168.137.215.46650 > 192.168.137.1.12000: Flags [P.], seq 43517:44977, ack 23077, win 467, length 1460
21:42:40.178192 IP 192.168.137.1.12000 > 192.168.137.215.46650: Flags [P.], seq 23077:24101, ack 37677, win 256, length 1024
21:42:40.178243 IP 192.168.137.1.12000 > 192.168.137.215.46650: Flags [P.], seq 24101:25561, ack 37677, win 256, length 1460
21:42:40.178254 IP 192.168.137.1.12000 > 192.168.137.215.46650: Flags [P.], seq 25561:26149, ack 37677, win 256, length 588
21:42:40.178266 IP 192.168.137.1.12000 > 192.168.137.215.46650: Flags [P.], seq 26149:27609, ack 37677, win 256, length 1460
21:42:40.178276 IP 192.168.137.1.12000 > 192.168.137.215.46650: Flags [P.], seq 27609:28197, ack 37677, win 256, length 588
21:42:40.178289 IP 192.168.137.1.12000 > 192.168.137.215.46650: Flags [P.], seq 28197:29657, ack 37677, win 256, length 1460
21:42:40.178460 IP 192.168.137.1.12000 > 192.168.137.215.46650: Flags [P.], seq 29657:30245, ack 37677, win 256, length 588
21:42:40.178481 IP 192.168.137.1.12000 > 192.168.137.215.46650: Flags [P.], seq 30245:31705, ack 37677, win 256, length 1460
21:42:40.178496 IP 192.168.137.1.12000 > 192.168.137.215.46650: Flags [P.], seq 31705:32293, ack 37677, win 256, length 588
21:42:40.178508 IP 192.168.137.1.12000 > 192.168.137.215.46650: Flags [P.], seq 32293:33753, ack 37677, win 256, length 1460
21:42:40.181848 IP 192.168.137.1.12000 > 192.168.137.215.46650: Flags [P.], seq 33753:34341, ack 37677, win 256, length 588
21:42:40.181883 IP 192.168.137.1.12000 > 192.168.137.215.46650: Flags [P.], seq 34341:35801, ack 37677, win 256, length 1460
21:42:40.181902 IP 192.168.137.1.12000 > 192.168.137.215.46650: Flags [P.], seq 35801:36389, ack 37677, win 256, length 588
21:42:40.181915 IP 192.168.137.1.12000 > 192.168.137.215.46650: Flags [P.], seq 36389:37677, ack 39137, win 256, length 1288
21:42:40.181976 IP 192.168.137.1.12000 > 192.168.137.215.46650: Flags [P.], seq 37677:39137, ack 39137, win 256, length 1460
21:42:40.181992 IP 192.168.137.1.12000 > 192.168.137.215.46650: Flags [.], ack 40597, win 256, length 0
21:42:40.182008 IP 192.168.137.1.12000 > 192.168.137.215.46650: Flags [P.], seq 39137:40597, ack 40597, win 256, length 1460
21:42:40.182169 IP 192.168.137.1.12000 > 192.168.137.215.46650: Flags [.], ack 42057, win 256, length 0
21:42:40.182186 IP 192.168.137.1.12000 > 192.168.137.215.46650: Flags [P.], seq 40597:42057, ack 42057, win 256, length 1460
21:42:40.182301 IP 192.168.137.215.46650 > 192.168.137.1.12000: Flags [.], ack 42057, win 319, length 0
21:42:40.183447 IP 192.168.137.215.46650 > 192.168.137.1.12000: Flags [.], seq 44977:46437, ack 42057, win 501, length 1460
21:42:40.183517 IP 192.168.137.215.46650 > 192.168.137.1.12000: Flags [.], seq 46437:47897, ack 42057, win 501, length 1460
21:42:40.183533 IP 192.168.137.215.46650 > 192.168.137.1.12000: Flags [.], seq 47897:49357, ack 42057, win 501, length 1460
21:42:40.183543 IP 192.168.137.215.46650 > 192.168.137.1.12000: Flags [P.], seq 49357:50817, ack 42057, win 501, length 1460
21:42:40.184854 IP 192.168.137.215.46650 > 192.168.137.1.12000: Flags [.], seq 50817:52277, ack 42057, win 501, length 1460
21:42:40.184884 IP 192.168.137.215.46650 > 192.168.137.1.12000: Flags [.], seq 52277:53737, ack 42057, win 501, length 1460
21:42:40.184896 IP 192.168.137.215.46650 > 192.168.137.1.12000: Flags [P.], seq 53737:55197, ack 42057, win 501, length 1460
21:42:40.188217 IP 192.168.137.1.12000 > 192.168.137.215.46650: Flags [.], ack 43517, win 256, length 0
21:42:40.188900 IP 192.168.137.1.12000 > 192.168.137.215.46650: Flags [P.], seq 42057:43517, ack 43517, win 256, length 1460
21:42:40.188939 IP 192.168.137.1.12000 > 192.168.137.215.46650: Flags [.], ack 44977, win 256, length 0
21:42:40.188964 IP 192.168.137.1.12000 > 192.168.137.215.46650: Flags [P.], seq 43517:44977, ack 44977, win 256, length 1460
21:42:40.188974 IP 192.168.137.1.12000 > 192.168.137.215.46650: Flags [.], ack 46437, win 256, length 0
21:42:40.188990 IP 192.168.137.1.12000 > 192.168.137.215.46650: Flags [P.], seq 44977:46437, ack 46437, win 256, length 1460
21:42:40.189267 IP 192.168.137.1.12000 > 192.168.137.215.46650: Flags [.], ack 47897, win 256, length 0
21:42:40.189285 IP 192.168.137.1.12000 > 192.168.137.215.46650: Flags [P.], seq 46437:47897, ack 47897, win 256, length 1460
21:42:40.190335 IP 192.168.137.215.46650 > 192.168.137.1.12000: Flags [.], seq 55197:56657, ack 47897, win 456, length 1460
21:42:40.190368 IP 192.168.137.215.46650 > 192.168.137.1.12000: Flags [.], seq 56657:58117, ack 47897, win 456, length 1460
21:42:40.190380 IP 192.168.137.215.46650 > 192.168.137.1.12000: Flags [P.], seq 58117:59577, ack 47897, win 456, length 1460
21:42:40.191141 IP 192.168.137.215.46650 > 192.168.137.1.12000: Flags [.], seq 59577:61037, ack 47897, win 456, length 1460
21:42:40.191175 IP 192.168.137.215.46650 > 192.168.137.1.12000: Flags [.], seq 61037:62497, ack 47897, win 456, length 1460
21:42:40.191187 IP 192.168.137.215.46650 > 192.168.137.1.12000: Flags [.], seq 62497:63957, ack 47897, win 456, length 1460
21:42:40.191197 IP 192.168.137.215.46650 > 192.168.137.1.12000: Flags [.], seq 63957:65417, ack 47897, win 456, length 1460
21:42:40.191207 IP 192.168.137.215.46650 > 192.168.137.1.12000: Flags [P.], seq 65417:66877, ack 47897, win 456, length 1460
21:42:40.196328 IP 192.168.137.1.12000 > 192.168.137.215.46650: Flags [.], ack 49357, win 256, length 0
21:42:40.202685 IP 192.168.137.1.12000 > 192.168.137.215.46650: Flags [P.], seq 47897:49357, ack 49357, win 256, length 1460
21:42:40.202730 IP 192.168.137.1.12000 > 192.168.137.215.46650: Flags [.], ack 50817, win 256, length 0
21:42:40.202751 IP 192.168.137.1.12000 > 192.168.137.215.46650: Flags [P.], seq 49357:50817, ack 50817, win 256, length 1460
21:42:40.202758 IP 192.168.137.1.12000 > 192.168.137.215.46650: Flags [.], ack 52277, win 256, length 0
21:42:40.202767 IP 192.168.137.1.12000 > 192.168.137.215.46650: Flags [P.], seq 50817:52277, ack 52277, win 256, length 1460
21:42:40.202773 IP 192.168.137.1.12000 > 192.168.137.215.46650: Flags [.], ack 53737, win 256, length 0
21:42:40.202780 IP 192.168.137.1.12000 > 192.168.137.215.46650: Flags [P.], seq 52277:53737, ack 53737, win 256, length 1460
21:42:40.210119 IP 192.168.137.1.12000 > 192.168.137.215.46650: Flags [.], ack 55197, win 256, length 0
21:42:40.210154 IP 192.168.137.1.12000 > 192.168.137.215.46650: Flags [P.], seq 53737:55197, ack 55197, win 256, length 1460
21:42:40.210183 IP 192.168.137.1.12000 > 192.168.137.215.46650: Flags [.], ack 56657, win 256, length 0
21:42:40.210192 IP 192.168.137.1.12000 > 192.168.137.215.46650: Flags [P.], seq 55197:56657, ack 56657, win 256, length 1460
21:42:40.210198 IP 192.168.137.1.12000 > 192.168.137.215.46650: Flags [.], ack 58117, win 256, length 0
21:42:40.210206 IP 192.168.137.1.12000 > 192.168.137.215.46650: Flags [P.], seq 56657:58117, ack 58117, win 256, length 1460
21:42:40.211796 IP 192.168.137.215.46650 > 192.168.137.1.12000: Flags [.], seq 66877:68337, ack 58117, win 377, length 1460
21:42:40.211830 IP 192.168.137.215.46650 > 192.168.137.1.12000: Flags [.], seq 68337:69797, ack 58117, win 377, length 1460
21:42:40.211841 IP 192.168.137.215.46650 > 192.168.137.1.12000: Flags [P.], seq 69797:71257, ack 58117, win 377, length 1460
21:42:40.211873 IP 192.168.137.215.46650 > 192.168.137.1.12000: Flags [.], seq 71257:72717, ack 58117, win 377, length 1460
21:42:40.211883 IP 192.168.137.215.46650 > 192.168.137.1.12000: Flags [.], seq 72717:74177, ack 58117, win 377, length 1460
21:42:40.211892 IP 192.168.137.215.46650 > 192.168.137.1.12000: Flags [.], seq 74177:75637, ack 58117, win 377, length 1460
21:42:40.211902 IP 192.168.137.215.46650 > 192.168.137.1.12000: Flags [.], seq 75637:77097, ack 58117, win 377, length 1460
21:42:40.211911 IP 192.168.137.215.46650 > 192.168.137.1.12000: Flags [P.], seq 77097:78557, ack 58117, win 377, length 1460
21:42:40.213317 IP 192.168.137.1.12000 > 192.168.137.215.46650: Flags [.], ack 59577, win 256, length 0
21:42:40.213359 IP 192.168.137.1.12000 > 192.168.137.215.46650: Flags [P.], seq 58117:59577, ack 59577, win 256, length 1460
21:42:40.213389 IP 192.168.137.1.12000 > 192.168.137.215.46650: Flags [.], ack 61037, win 256, length 0
21:42:40.213399 IP 192.168.137.1.12000 > 192.168.137.215.46650: Flags [P.], seq 59577:61037, ack 61037, win 256, length 1460
21:42:40.213405 IP 192.168.137.1.12000 > 192.168.137.215.46650: Flags [.], ack 62497, win 256, length 0
21:42:40.213413 IP 192.168.137.1.12000 > 192.168.137.215.46650: Flags [P.], seq 61037:62497, ack 62497, win 256, length 1460
21:42:40.213488 IP 192.168.137.1.12000 > 192.168.137.215.46650: Flags [.], ack 63957, win 256, length 0
21:42:40.213496 IP 192.168.137.1.12000 > 192.168.137.215.46650: Flags [P.], seq 62497:63957, ack 63957, win 256, length 1460
21:42:40.220742 IP 192.168.137.215.46650 > 192.168.137.1.12000: Flags [.], seq 78557:80017, ack 63957, win 332, length 1460
21:42:40.220775 IP 192.168.137.215.46650 > 192.168.137.1.12000: Flags [.], seq 80017:81477, ack 63957, win 332, length 1460
21:42:40.220787 IP 192.168.137.215.46650 > 192.168.137.1.12000: Flags [P.], seq 81477:82937, ack 63957, win 332, length 1460
21:42:40.222801 IP 192.168.137.1.12000 > 192.168.137.215.46650: Flags [.], ack 65417, win 256, length 0
21:42:40.222865 IP 192.168.137.215.46650 > 192.168.137.1.12000: Flags [.], seq 82937:84397, ack 63957, win 332, length 1460
21:42:40.222898 IP 192.168.137.215.46650 > 192.168.137.1.12000: Flags [.], seq 84397:85857, ack 63957, win 332, length 1460
21:42:40.222909 IP 192.168.137.215.46650 > 192.168.137.1.12000: Flags [.], seq 85857:87317, ack 63957, win 332, length 1460
21:42:40.222919 IP 192.168.137.215.46650 > 192.168.137.1.12000: Flags [P.], seq 87317:88777, ack 63957, win 332, length 1460
21:42:40.222940 IP 192.168.137.1.12000 > 192.168.137.215.46650: Flags [P.], seq 63957:65417, ack 65417, win 256, length 1460
21:42:40.222966 IP 192.168.137.1.12000 > 192.168.137.215.46650: Flags [.], ack 66877, win 256, length 0
21:42:40.222987 IP 192.168.137.1.12000 > 192.168.137.215.46650: Flags [P.], seq 65417:66877, ack 66877, win 256, length 1460
21:42:40.222995 IP 192.168.137.1.12000 > 192.168.137.215.46650: Flags [.], ack 68337, win 256, length 0
21:42:40.223004 IP 192.168.137.1.12000 > 192.168.137.215.46650: Flags [P.], seq 66877:68337, ack 68337, win 256, length 1460
21:42:40.223010 IP 192.168.137.1.12000 > 192.168.137.215.46650: Flags [.], ack 69797, win 256, length 0
21:42:40.223017 IP 192.168.137.1.12000 > 192.168.137.215.46650: Flags [P.], seq 68337:69797, ack 69797, win 256, length 1460
21:42:40.223075 IP 192.168.137.1.12000 > 192.168.137.215.46650: Flags [.], ack 71257, win 256, length 0
21:42:40.223086 IP 192.168.137.1.12000 > 192.168.137.215.46650: Flags [P.], seq 69797:71257, ack 71257, win 256, length 1460
21:42:40.223092 IP 192.168.137.1.12000 > 192.168.137.215.46650: Flags [.], ack 72717, win 256, length 0
21:42:40.223100 IP 192.168.137.1.12000 > 192.168.137.215.46650: Flags [P.], seq 71257:72717, ack 72717, win 256, length 1460
21:42:40.223106 IP 192.168.137.1.12000 > 192.168.137.215.46650: Flags [.], ack 74177, win 256, length 0
21:42:40.223113 IP 192.168.137.1.12000 > 192.168.137.215.46650: Flags [P.], seq 72717:74177, ack 74177, win 256, length 1460
21:42:40.223807 IP 192.168.137.1.12000 > 192.168.137.215.46650: Flags [.], ack 75637, win 256, length 0
21:42:40.223831 IP 192.168.137.1.12000 > 192.168.137.215.46650: Flags [P.], seq 74177:75637, ack 75637, win 256, length 1460
21:42:40.223955 IP 192.168.137.215.46650 > 192.168.137.1.12000: Flags [.], ack 75637, win 501, length 0
21:42:40.227291 IP 192.168.137.1.12000 > 192.168.137.215.46650: Flags [.], ack 77097, win 256, length 0
21:42:40.227318 IP 192.168.137.1.12000 > 192.168.137.215.46650: Flags [P.], seq 75637:77097, ack 77097, win 256, length 1460
21:42:40.227341 IP 192.168.137.1.12000 > 192.168.137.215.46650: Flags [.], ack 78557, win 256, length 0
21:42:40.227351 IP 192.168.137.1.12000 > 192.168.137.215.46650: Flags [P.], seq 77097:78557, ack 78557, win 256, length 1460
21:42:40.227369 IP 192.168.137.215.46650 > 192.168.137.1.12000: Flags [.], ack 78557, win 547, length 0
21:42:40.227399 IP 192.168.137.1.12000 > 192.168.137.215.46650: Flags [.], ack 80017, win 256, length 0
21:42:40.227415 IP 192.168.137.215.46650 > 192.168.137.1.12000: Flags [.], seq 88777:90237, ack 78557, win 547, length 1460
21:42:40.227464 IP 192.168.137.215.46650 > 192.168.137.1.12000: Flags [.], seq 90237:91697, ack 78557, win 547, length 1460
21:42:40.227476 IP 192.168.137.215.46650 > 192.168.137.1.12000: Flags [.], seq 91697:93157, ack 78557, win 547, length 1460
21:42:40.227486 IP 192.168.137.215.46650 > 192.168.137.1.12000: Flags [.], seq 93157:94617, ack 78557, win 547, length 1460
21:42:40.227495 IP 192.168.137.215.46650 > 192.168.137.1.12000: Flags [.], seq 94617:96077, ack 78557, win 547, length 1460
21:42:40.227505 IP 192.168.137.215.46650 > 192.168.137.1.12000: Flags [.], seq 96077:97537, ack 78557, win 547, length 1460
21:42:40.227514 IP 192.168.137.215.46650 > 192.168.137.1.12000: Flags [.], seq 97537:98997, ack 78557, win 547, length 1460
21:42:40.227524 IP 192.168.137.215.46650 > 192.168.137.1.12000: Flags [.], seq 98997:100457, ack 78557, win 547, length 1460
21:42:40.227533 IP 192.168.137.215.46650 > 192.168.137.1.12000: Flags [P.], seq 100457:101917, ack 78557, win 547, length 1460
21:42:40.227549 IP 192.168.137.1.12000 > 192.168.137.215.46650: Flags [P.], seq 78557:80017, ack 80017, win 256, length 1460
21:42:40.238764 IP 192.168.137.1.12000 > 192.168.137.215.46650: Flags [.], ack 81477, win 256, length 0
21:42:40.238790 IP 192.168.137.1.12000 > 192.168.137.215.46650: Flags [P.], seq 80017:81477, ack 81477, win 256, length 1460
21:42:40.238810 IP 192.168.137.215.46650 > 192.168.137.1.12000: Flags [.], ack 81477, win 592, length 0
21:42:40.238855 IP 192.168.137.1.12000 > 192.168.137.215.46650: Flags [.], ack 82937, win 256, length 0
21:42:40.238867 IP 192.168.137.1.12000 > 192.168.137.215.46650: Flags [P.], seq 81477:82937, ack 82937, win 256, length 1460
21:42:40.238876 IP 192.168.137.1.12000 > 192.168.137.215.46650: Flags [.], ack 84397, win 256, length 0
21:42:40.238883 IP 192.168.137.1.12000 > 192.168.137.215.46650: Flags [P.], seq 82937:84397, ack 84397, win 256, length 1460
21:42:40.238896 IP 192.168.137.215.46650 > 192.168.137.1.12000: Flags [.], ack 84397, win 638, length 0
21:42:40.238909 IP 192.168.137.1.12000 > 192.168.137.215.46650: Flags [.], ack 85857, win 256, length 0
21:42:40.238917 IP 192.168.137.1.12000 > 192.168.137.215.46650: Flags [P.], seq 84397:85857, ack 85857, win 256, length 1460
21:42:40.238960 IP 192.168.137.1.12000 > 192.168.137.215.46650: Flags [.], ack 87317, win 256, length 0
21:42:40.238969 IP 192.168.137.1.12000 > 192.168.137.215.46650: Flags [P.], seq 85857:87317, ack 87317, win 256, length 1460
21:42:40.238979 IP 192.168.137.215.46650 > 192.168.137.1.12000: Flags [.], ack 87317, win 684, length 0
21:42:40.238993 IP 192.168.137.1.12000 > 192.168.137.215.46650: Flags [.], ack 88777, win 256, length 0
21:42:40.239092 IP 192.168.137.1.12000 > 192.168.137.215.46650: Flags [P.], seq 87317:88777, ack 88777, win 256, length 1460
21:42:40.239101 IP 192.168.137.1.12000 > 192.168.137.215.46650: Flags [.], ack 90237, win 256, length 0
21:42:40.239112 IP 192.168.137.1.12000 > 192.168.137.215.46650: Flags [P.], seq 88777:90237, ack 90237, win 256, length 1460
21:42:40.239122 IP 192.168.137.215.46650 > 192.168.137.1.12000: Flags [.], ack 90237, win 729, length 0
21:42:40.239141 IP 192.168.137.1.12000 > 192.168.137.215.46650: Flags [.], ack 91697, win 256, length 0
21:42:40.239149 IP 192.168.137.1.12000 > 192.168.137.215.46650: Flags [P.], seq 90237:91697, ack 91697, win 256, length 1460
21:42:40.239155 IP 192.168.137.1.12000 > 192.168.137.215.46650: Flags [.], ack 93157, win 256, length 0
21:42:40.240987 IP 192.168.137.1.12000 > 192.168.137.215.46650: Flags [P.], seq 91697:93157, ack 93157, win 256, length 1460
21:42:40.241015 IP 192.168.137.215.46650 > 192.168.137.1.12000: Flags [.], ack 93157, win 775, length 0
21:42:40.247485 IP 192.168.137.215.46650 > 192.168.137.1.12000: Flags [.], seq 101917:103377, ack 93157, win 775, length 1460
21:42:40.247518 IP 192.168.137.215.46650 > 192.168.137.1.12000: Flags [P.], seq 103377:104837, ack 93157, win 775, length 1460
21:42:40.247550 IP 192.168.137.215.46650 > 192.168.137.1.12000: Flags [.], seq 104837:106297, ack 93157, win 775, length 1460
21:42:40.247561 IP 192.168.137.215.46650 > 192.168.137.1.12000: Flags [.], seq 106297:107757, ack 93157, win 775, length 1460
21:42:40.247571 IP 192.168.137.215.46650 > 192.168.137.1.12000: Flags [.], seq 107757:109217, ack 93157, win 775, length 1460
21:42:40.247581 IP 192.168.137.215.46650 > 192.168.137.1.12000: Flags [P.], seq 109217:110677, ack 93157, win 775, length 1460
21:42:40.249905 IP 192.168.137.1.12000 > 192.168.137.215.46650: Flags [.], ack 94617, win 256, length 0
21:42:40.249972 IP 192.168.137.215.46650 > 192.168.137.1.12000: Flags [.], seq 110677:112137, ack 93157, win 775, length 1460
21:42:40.250007 IP 192.168.137.215.46650 > 192.168.137.1.12000: Flags [.], seq 112137:113597, ack 93157, win 775, length 1460
21:42:40.250018 IP 192.168.137.215.46650 > 192.168.137.1.12000: Flags [.], seq 113597:115057, ack 93157, win 775, length 1460
21:42:40.250028 IP 192.168.137.215.46650 > 192.168.137.1.12000: Flags [.], seq 115057:116517, ack 93157, win 775, length 1460
21:42:40.250037 IP 192.168.137.215.46650 > 192.168.137.1.12000: Flags [.], seq 116517:117977, ack 93157, win 775, length 1460
21:42:40.250047 IP 192.168.137.215.46650 > 192.168.137.1.12000: Flags [P.], seq 117977:119437, ack 93157, win 775, length 1460
21:42:40.250067 IP 192.168.137.1.12000 > 192.168.137.215.46650: Flags [P.], seq 93157:94617, ack 94617, win 256, length 1460
21:42:40.250098 IP 192.168.137.1.12000 > 192.168.137.215.46650: Flags [.], ack 96077, win 256, length 0
21:42:40.250107 IP 192.168.137.1.12000 > 192.168.137.215.46650: Flags [P.], seq 94617:96077, ack 96077, win 256, length 1460
21:42:40.250124 IP 192.168.137.215.46650 > 192.168.137.1.12000: Flags [.], ack 96077, win 820, length 0
21:42:40.250138 IP 192.168.137.1.12000 > 192.168.137.215.46650: Flags [.], ack 97537, win 256, length 0
21:42:40.250148 IP 192.168.137.1.12000 > 192.168.137.215.46650: Flags [P.], seq 96077:97537, ack 97537, win 256, length 1460
21:42:40.250155 IP 192.168.137.1.12000 > 192.168.137.215.46650: Flags [.], ack 98997, win 256, length 0
21:42:40.250168 IP 192.168.137.1.12000 > 192.168.137.215.46650: Flags [P.], seq 97537:98997, ack 98997, win 256, length 1460
21:42:40.250179 IP 192.168.137.215.46650 > 192.168.137.1.12000: Flags [.], ack 98997, win 866, length 0
21:42:40.250217 IP 192.168.137.1.12000 > 192.168.137.215.46650: Flags [.], ack 100457, win 256, length 0
21:42:40.250227 IP 192.168.137.1.12000 > 192.168.137.215.46650: Flags [P.], seq 98997:100457, ack 100457, win 256, length 1460
21:42:40.250315 IP 192.168.137.1.12000 > 192.168.137.215.46650: Flags [.], ack 101917, win 256, length 0
21:42:40.250331 IP 192.168.137.1.12000 > 192.168.137.215.46650: Flags [P.], seq 100457:101917, ack 101917, win 256, length 1460
21:42:40.250343 IP 192.168.137.215.46650 > 192.168.137.1.12000: Flags [.], ack 101917, win 912, length 0
21:42:40.254859 IP 192.168.137.1.12000 > 192.168.137.215.46650: Flags [.], ack 103377, win 256, length 0
21:42:40.254891 IP 192.168.137.1.12000 > 192.168.137.215.46650: Flags [P.], seq 101917:103377, ack 103377, win 256, length 1460
21:42:40.254921 IP 192.168.137.1.12000 > 192.168.137.215.46650: Flags [.], ack 104837, win 256, length 0
21:42:40.254951 IP 192.168.137.1.12000 > 192.168.137.215.46650: Flags [P.], seq 103377:104837, ack 104837, win 256, length 1460
21:42:40.254974 IP 192.168.137.215.46650 > 192.168.137.1.12000: Flags [.], ack 104837, win 957, length 0
21:42:40.255013 IP 192.168.137.1.12000 > 192.168.137.215.46650: Flags [.], ack 106297, win 256, length 0
21:42:40.255024 IP 192.168.137.1.12000 > 192.168.137.215.46650: Flags [P.], seq 104837:106297, ack 106297, win 256, length 1460
21:42:40.255114 IP 192.168.137.1.12000 > 192.168.137.215.46650: Flags [.], ack 107757, win 256, length 0
21:42:40.255129 IP 192.168.137.1.12000 > 192.168.137.215.46650: Flags [P.], seq 106297:107757, ack 107757, win 256, length 1460
21:42:40.255146 IP 192.168.137.215.46650 > 192.168.137.1.12000: Flags [.], ack 107757, win 1003, length 0
21:42:40.259348 IP 192.168.137.215.46650 > 192.168.137.1.12000: Flags [.], seq 119437:120897, ack 107757, win 1003, length 1460
21:42:40.259377 IP 192.168.137.215.46650 > 192.168.137.1.12000: Flags [.], seq 120897:122357, ack 107757, win 1003, length 1460
21:42:40.259387 IP 192.168.137.215.46650 > 192.168.137.1.12000: Flags [.], seq 122357:123817, ack 107757, win 1003, length 1460
21:42:40.259396 IP 192.168.137.215.46650 > 192.168.137.1.12000: Flags [.], seq 123817:125277, ack 107757, win 1003, length 1460
21:42:40.259405 IP 192.168.137.215.46650 > 192.168.137.1.12000: Flags [P.], seq 125277:126737, ack 107757, win 1003, length 1460
21:42:40.275625 IP 192.168.137.1.12000 > 192.168.137.215.46650: Flags [.], ack 113597, win 256, length 0
21:42:40.275707 IP 192.168.137.215.46650 > 192.168.137.1.12000: Flags [.], seq 126737:128197, ack 107757, win 1003, length 1460
21:42:40.275744 IP 192.168.137.215.46650 > 192.168.137.1.12000: Flags [.], seq 128197:129657, ack 107757, win 1003, length 1460
21:42:40.275756 IP 192.168.137.215.46650 > 192.168.137.1.12000: Flags [.], seq 129657:131117, ack 107757, win 1003, length 1460
21:42:40.275766 IP 192.168.137.215.46650 > 192.168.137.1.12000: Flags [.], seq 131117:132577, ack 107757, win 1003, length 1460
21:42:40.275775 IP 192.168.137.215.46650 > 192.168.137.1.12000: Flags [.], seq 132577:134037, ack 107757, win 1003, length 1460
21:42:40.275784 IP 192.168.137.215.46650 > 192.168.137.1.12000: Flags [.], seq 134037:135497, ack 107757, win 1003, length 1460
21:42:40.275794 IP 192.168.137.215.46650 > 192.168.137.1.12000: Flags [.], seq 135497:136957, ack 107757, win 1003, length 1460
21:42:40.275803 IP 192.168.137.215.46650 > 192.168.137.1.12000: Flags [.], seq 136957:138417, ack 107757, win 1003, length 1460
21:42:40.275813 IP 192.168.137.215.46650 > 192.168.137.1.12000: Flags [P.], seq 138417:139877, ack 107757, win 1003, length 1460
21:42:40.275834 IP 192.168.137.1.12000 > 192.168.137.215.46650: Flags [P.], seq 107757:109217, ack 113597, win 256, length 1460
21:42:40.275863 IP 192.168.137.1.12000 > 192.168.137.215.46650: Flags [P.], seq 109217:109805, ack 113597, win 256, length 588
21:42:40.275877 IP 192.168.137.215.46650 > 192.168.137.1.12000: Flags [.], ack 109805, win 1049, length 0
21:42:40.275890 IP 192.168.137.1.12000 > 192.168.137.215.46650: Flags [P.], seq 109805:111265, ack 113597, win 256, length 1460
21:42:40.275897 IP 192.168.137.1.12000 > 192.168.137.215.46650: Flags [P.], seq 111265:111853, ack 113597, win 256, length 588
21:42:40.275907 IP 192.168.137.215.46650 > 192.168.137.1.12000: Flags [.], ack 111853, win 1094, length 0
21:42:40.275919 IP 192.168.137.1.12000 > 192.168.137.215.46650: Flags [P.], seq 111853:113313, ack 113597, win 256, length 1460
21:42:40.275925 IP 192.168.137.1.12000 > 192.168.137.215.46650: Flags [P.], seq 113313:113597, ack 113597, win 256, length 284
21:42:40.275934 IP 192.168.137.215.46650 > 192.168.137.1.12000: Flags [.], ack 113597, win 1140, length 0
21:42:40.275945 IP 192.168.137.1.12000 > 192.168.137.215.46650: Flags [.], ack 119437, win 513, length 0
21:42:40.275987 IP 192.168.137.1.12000 > 192.168.137.215.46650: Flags [P.], seq 113597:115057, ack 119437, win 513, length 1460
21:42:40.275994 IP 192.168.137.1.12000 > 192.168.137.215.46650: Flags [P.], seq 115057:115645, ack 119437, win 513, length 588
21:42:40.276004 IP 192.168.137.215.46650 > 192.168.137.1.12000: Flags [.], ack 115645, win 1185, length 0
21:42:40.276357 IP 192.168.137.1.12000 > 192.168.137.215.46650: Flags [P.], seq 115645:117105, ack 119437, win 513, length 1460
21:42:40.276390 IP 192.168.137.1.12000 > 192.168.137.215.46650: Flags [P.], seq 117105:117693, ack 119437, win 513, length 588
21:42:40.276410 IP 192.168.137.215.46650 > 192.168.137.1.12000: Flags [.], ack 117693, win 1231, length 0
21:42:40.276445 IP 192.168.137.1.12000 > 192.168.137.215.46650: Flags [P.], seq 117693:119153, ack 119437, win 513, length 1460
21:42:40.276455 IP 192.168.137.1.12000 > 192.168.137.215.46650: Flags [P.], seq 119153:119437, ack 119437, win 513, length 284
21:42:40.276467 IP 192.168.137.215.46650 > 192.168.137.1.12000: Flags [.], ack 119437, win 1277, length 0
21:42:40.276480 IP 192.168.137.1.12000 > 192.168.137.215.46650: Flags [.], ack 123817, win 513, length 0
21:42:40.276495 IP 192.168.137.1.12000 > 192.168.137.215.46650: Flags [P.], seq 119437:120897, ack 123817, win 513, length 1460
21:42:40.276501 IP 192.168.137.1.12000 > 192.168.137.215.46650: Flags [P.], seq 120897:121485, ack 123817, win 513, length 588
21:42:40.276511 IP 192.168.137.215.46650 > 192.168.137.1.12000: Flags [.], ack 121485, win 1322, length 0
21:42:40.280488 IP 192.168.137.215.46650 > 192.168.137.1.12000: Flags [.], seq 139877:141337, ack 121485, win 1322, length 1460
21:42:40.280522 IP 192.168.137.215.46650 > 192.168.137.1.12000: Flags [P.], seq 141337:142797, ack 121485, win 1322, length 1460
21:42:40.286552 IP 192.168.137.1.12000 > 192.168.137.215.46650: Flags [P.], seq 121485:122945, ack 123817, win 513, length 1460
21:42:40.286600 IP 192.168.137.1.12000 > 192.168.137.215.46650: Flags [P.], seq 122945:123533, ack 123817, win 513, length 588
21:42:40.286624 IP 192.168.137.215.46650 > 192.168.137.1.12000: Flags [.], ack 123533, win 1368, length 0
21:42:40.286664 IP 192.168.137.1.12000 > 192.168.137.215.46650: Flags [P.], seq 123533:123817, ack 126737, win 513, length 284
21:42:40.286711 IP 192.168.137.215.46650 > 192.168.137.1.12000: Flags [.], seq 142797:144257, ack 123817, win 1391, length 1460
21:42:40.286725 IP 192.168.137.215.46650 > 192.168.137.1.12000: Flags [.], seq 144257:145717, ack 123817, win 1391, length 1460
21:42:40.286735 IP 192.168.137.215.46650 > 192.168.137.1.12000: Flags [.], seq 145717:147177, ack 123817, win 1391, length 1460
21:42:40.286744 IP 192.168.137.215.46650 > 192.168.137.1.12000: Flags [.], seq 147177:148637, ack 123817, win 1391, length 1460
21:42:40.286754 IP 192.168.137.215.46650 > 192.168.137.1.12000: Flags [.], seq 148637:150097, ack 123817, win 1391, length 1460
21:42:40.286763 IP 192.168.137.215.46650 > 192.168.137.1.12000: Flags [.], seq 150097:151557, ack 123817, win 1391, length 1460
21:42:40.286773 IP 192.168.137.215.46650 > 192.168.137.1.12000: Flags [P.], seq 151557:153017, ack 123817, win 1391, length 1460
21:42:40.286792 IP 192.168.137.1.12000 > 192.168.137.215.46650: Flags [P.], seq 123817:125277, ack 126737, win 513, length 1460
21:42:40.286800 IP 192.168.137.1.12000 > 192.168.137.215.46650: Flags [P.], seq 125277:125865, ack 126737, win 513, length 588
21:42:40.286810 IP 192.168.137.215.46650 > 192.168.137.1.12000: Flags [.], ack 125865, win 1436, length 0
21:42:40.286822 IP 192.168.137.1.12000 > 192.168.137.215.46650: Flags [P.], seq 125865:126737, ack 135497, win 513, length 872
21:42:40.286857 IP 192.168.137.215.46650 > 192.168.137.1.12000: Flags [.], seq 153017:154477, ack 126737, win 1459, length 1460
21:42:40.286868 IP 192.168.137.215.46650 > 192.168.137.1.12000: Flags [.], seq 154477:155937, ack 126737, win 1459, length 1460
21:42:40.286877 IP 192.168.137.215.46650 > 192.168.137.1.12000: Flags [.], seq 155937:157397, ack 126737, win 1459, length 1460
21:42:40.286886 IP 192.168.137.215.46650 > 192.168.137.1.12000: Flags [.], seq 157397:158857, ack 126737, win 1459, length 1460
21:42:40.286896 IP 192.168.137.215.46650 > 192.168.137.1.12000: Flags [.], seq 158857:160317, ack 126737, win 1459, length 1460
21:42:40.286905 IP 192.168.137.215.46650 > 192.168.137.1.12000: Flags [P.], seq 160317:161777, ack 126737, win 1459, length 1460
21:42:40.286919 IP 192.168.137.1.12000 > 192.168.137.215.46650: Flags [P.], seq 126737:128197, ack 135497, win 513, length 1460
21:42:40.286926 IP 192.168.137.1.12000 > 192.168.137.215.46650: Flags [P.], seq 128197:128785, ack 135497, win 513, length 588
21:42:40.286943 IP 192.168.137.215.46650 > 192.168.137.1.12000: Flags [.], ack 128785, win 1505, length 0
21:42:40.287011 IP 192.168.137.1.12000 > 192.168.137.215.46650: Flags [P.], seq 128785:130245, ack 135497, win 513, length 1460
21:42:40.287019 IP 192.168.137.1.12000 > 192.168.137.215.46650: Flags [P.], seq 130245:130833, ack 135497, win 513, length 588
21:42:40.287031 IP 192.168.137.215.46650 > 192.168.137.1.12000: Flags [.], ack 130833, win 1550, length 0
21:42:40.287042 IP 192.168.137.1.12000 > 192.168.137.215.46650: Flags [P.], seq 130833:132293, ack 135497, win 513, length 1460
21:42:40.287049 IP 192.168.137.1.12000 > 192.168.137.215.46650: Flags [P.], seq 132293:132881, ack 135497, win 513, length 588
21:42:40.287060 IP 192.168.137.215.46650 > 192.168.137.1.12000: Flags [.], ack 132881, win 1596, length 0
21:42:40.287070 IP 192.168.137.1.12000 > 192.168.137.215.46650: Flags [P.], seq 132881:134341, ack 135497, win 513, length 1460
21:42:40.287077 IP 192.168.137.1.12000 > 192.168.137.215.46650: Flags [P.], seq 134341:134929, ack 135497, win 513, length 588
21:42:40.287088 IP 192.168.137.215.46650 > 192.168.137.1.12000: Flags [.], ack 134929, win 1642, length 0
21:42:40.287098 IP 192.168.137.1.12000 > 192.168.137.215.46650: Flags [P.], seq 134929:135497, ack 139877, win 513, length 568
21:42:40.289502 IP 192.168.137.1.12000 > 192.168.137.215.46650: Flags [P.], seq 135497:136957, ack 139877, win 513, length 1460
