21:41:47.330183 IP 192.168.137.215.46640 > 192.168.137.1.12000: Flags [S], seq 3939423169, win 64240, options [mss 1460,sackOK,TS val 594378863 ecr 0,nop,wscale 7], length 0
21:41:47.344550 IP 192.168.137.1.12000 > 192.168.137.215.46640: Flags [S.], seq 3735098545, ack 3939423170, win 65535, options [mss 1460,nop,wscale 8,nop,nop,sackOK], length 0
21:41:47.344575 IP 192.168.137.215.46640 > 192.168.137.1.12000: Flags [.], ack 1, win 502, length 0
21:41:47.344958 IP 192.168.137.215.46640 > 192.168.137.1.12000: Flags [P.], seq 1:14, ack 1, win 502, length 13
21:41:47.345136 IP 192.168.137.215.46640 > 192.168.137.1.12000: Flags [.], seq 14:1474, ack 1, win 502, length 1460
21:41:47.345458 IP 192.168.137.215.46640 > 192.168.137.1.12000: Flags [.], seq 1474:2934, ack 1, win 502, length 1460
21:41:47.345816 IP 192.168.137.215.46640 > 192.168.137.1.12000: Flags [.], seq 2934:4394, ack 1, win 502, length 1460
21:41:47.345819 IP 192.168.137.215.46640 > 192.168.137.1.12000: Flags [.], seq 4394:5854, ack 1, win 502, length 1460
21:41:47.345821 IP 192.168.137.215.46640 > 192.168.137.1.12000: Flags [P.], seq 5854:7314, ack 1, win 502, length 1460
21:41:47.346859 IP 192.168.137.215.46640 > 192.168.137.1.12000: Flags [.], seq 7314:8774, ack 1, win 502, length 1460
21:41:47.346862 IP 192.168.137.215.46640 > 192.168.137.1.12000: Flags [.], seq 8774:10234, ack 1, win 502, length 1460
21:41:47.346865 IP 192.168.137.215.46640 > 192.168.137.1.12000: Flags [.], seq 10234:11694, ack 1, win 502, length 1460
21:41:47.346867 IP 192.168.137.215.46640 > 192.168.137.1.12000: Flags [P.], seq 11694:13154, ack 1, win 502, length 1460
21:41:47.540170 IP 192.168.137.1.12000 > 192.168.137.215.46640: Flags [P.], seq 1:14, ack 14, win 256, length 13
21:41:47.540254 IP 192.168.137.215.46640 > 192.168.137.1.12000: Flags [.], seq 13154:14614, ack 14, win 502, length 1460
21:41:47.540303 IP 192.168.137.1.12000 > 192.168.137.215.46640: Flags [.], ack 1474, win 256, length 0
21:41:47.540339 IP 192.168.137.215.46640 > 192.168.137.1.12000: Flags [.], seq 14614:16074, ack 14, win 502, length 1460
21:41:47.540353 IP 192.168.137.215.46640 > 192.168.137.1.12000: Flags [.], seq 16074:17534, ack 14, win 502, length 1460
21:41:47.540363 IP 192.168.137.215.46640 > 192.168.137.1.12000: Flags [P.], seq 17534:18994, ack 14, win 502, length 1460
21:41:47.540377 IP 192.168.137.1.12000 > 192.168.137.215.46640: Flags [P.], seq 14:1474, ack 1474, win 256, length 1460
21:41:47.540424 IP 192.168.137.215.46640 > 192.168.137.1.12000: Flags [.], ack 1474, win 491, length 0
21:41:47.540443 IP 192.168.137.1.12000 > 192.168.137.215.46640: Flags [.], ack 2934, win 256, length 0
21:41:47.540454 IP 192.168.137.1.12000 > 192.168.137.215.46640: Flags [P.], seq 1474:2934, ack 2934, win 256, length 1460
21:41:47.540462 IP 192.168.137.1.12000 > 192.168.137.215.46640: Flags [.], ack 4394, win 256, length 0
21:41:47.540471 IP 192.168.137.1.12000 > 192.168.137.215.46640: Flags [P.], seq 2934:4394, ack 4394, win 256, length 1460
21:41:47.540478 IP 192.168.137.1.12000 > 192.168.137.215.46640: Flags [.], ack 5854, win 256, length 0
21:41:47.540504 IP 192.168.137.215.46640 > 192.168.137.1.12000: Flags [.], ack 2934, win 480, length 0
21:41:47.540562 IP 192.168.137.1.12000 > 192.168.137.215.46640: Flags [P.], seq 4394:5854, ack 5854, win 256, length 1460
21:41:47.540562 IP 192.168.137.215.46640 > 192.168.137.1.12000: Flags [.], ack 4394, win 469, length 0
21:41:47.540570 IP 192.168.137.1.12000 > 192.168.137.215.46640: Flags [.], ack 7314, win 256, length 0
21:41:47.540575 IP 192.168.137.1.12000 > 192.168.137.215.46640: Flags [P.], seq 5854:7314, ack 7314, win 256, length 1460
21:41:47.540580 IP 192.168.137.1.12000 > 192.168.137.215.46640: Flags [.], ack 8774, win 256, length 0
21:41:47.540586 IP 192.168.137.1.12000 > 192.168.137.215.46640: Flags [P.], seq 7314:8774, ack 8774, win 256, length 1460
21:41:47.540592 IP 192.168.137.215.46640 > 192.168.137.1.12000: Flags [.], ack 5854, win 458, length 0
21:41:47.540594 IP 192.168.137.1.12000 > 192.168.137.215.46640: Flags [.], ack 10234, win 256, length 0
21:41:47.540599 IP 192.168.137.1.12000 > 192.168.137.215.46640: Flags [P.], seq 8774:10234, ack 10234, win 256, length 1460
21:41:47.540603 IP 192.168.137.1.12000 > 192.168.137.215.46640: Flags [.], ack 11694, win 256, length 0
21:41:47.540614 IP 192.168.137.215.46640 > 192.168.137.1.12000: Flags [.], ack 7314, win 447, length 0
21:41:47.540637 IP 192.168.137.1.12000 > 192.168.137.215.46640: Flags [P.], seq 10234:11694, ack 11694, win 256, length 1460
21:41:47.540644 IP 192.168.137.215.46640 > 192.168.137.1.12000: Flags [.], ack 8774, win 436, length 0
21:41:47.540645 IP 192.168.137.1.12000 > 192.168.137.215.46640: Flags [.], ack 13154, win 256, length 0
21:41:47.540650 IP 192.168.137.1.12000 > 192.168.137.215.46640: Flags [P.], seq 11694:13154, ack 13154, win 256, length 1460
21:41:47.540666 IP 192.168.137.215.46640 > 192.168.137.1.12000: Flags [.], ack 10234, win 425, length 0
21:41:47.540750 IP 192.168.137.215.46640 > 192.168.137.1.12000: Flags [.], ack 13154, win 403, length 0
21:41:47.548214 IP 192.168.137.215.46640 > 192.168.137.1.12000: Flags [.], seq 18994:20454, ack 13154, win 501, length 1460
21:41:47.548243 IP 192.168.137.215.46640 > 192.168.137.1.12000: Flags [P.], seq 20454:21914, ack 13154, win 501, length 1460
21:41:47.576247 IP 192.168.137.215.46640 > 192.168.137.1.12000: Flags [.], seq 21914:23374, ack 13154, win 501, length 1460
21:41:47.576276 IP 192.168.137.215.46640 > 192.168.137.1.12000: Flags [P.], seq 23374:24834, ack 13154, win 501, length 1460
21:41:47.595594 IP 192.168.137.1.12000 > 192.168.137.215.46640: Flags [.], ack 14614, win 256, length 0
21:41:47.595622 IP 192.168.137.1.12000 > 192.168.137.215.46640: Flags [P.], seq 13154:14614, ack 14614, win 256, length 1460
21:41:47.595665 IP 192.168.137.1.12000 > 192.168.137.215.46640: Flags [.], ack 16074, win 256, length 0
21:41:47.595672 IP 192.168.137.1.12000 > 192.168.137.215.46640: Flags [.], ack 17534, win 256, length 0
21:41:47.595678 IP 192.168.137.1.12000 > 192.168.137.215.46640: Flags [.], ack 18994, win 256, length 0
21:41:47.595684 IP 192.168.137.1.12000 > 192.168.137.215.46640: Flags [P.], seq 14614:16074, ack 18994, win 256, length 1460
21:41:47.595691 IP 192.168.137.1.12000 > 192.168.137.215.46640: Flags [P.], seq 16074:17534, ack 18994, win 256, length 1460
21:41:47.595697 IP 192.168.137.1.12000 > 192.168.137.215.46640: Flags [P.], seq 17534:18994, ack 18994, win 256, length 1460
21:41:47.595773 IP 192.168.137.215.46640 > 192.168.137.1.12000: Flags [.], ack 18994, win 474, length 0
21:41:47.622131 IP 192.168.137.215.46640 > 192.168.137.1.12000: Flags [.], seq 24834:26294, ack 18994, win 501, length 1460
21:41:47.622156 IP 192.168.137.215.46640 > 192.168.137.1.12000: Flags [P.], seq 26294:27754, ack 18994, win 501, length 1460
21:41:47.635470 IP 192.168.137.215.46640 > 192.168.137.1.12000: Flags [.], seq 27754:29214, ack 18994, win 501, length 1460
21:41:47.635496 IP 192.168.137.215.46640 > 192.168.137.1.12000: Flags [.], seq 29214:30674, ack 18994, win 501, length 1460
21:41:47.635504 IP 192.168.137.215.46640 > 192.168.137.1.12000: Flags [P.], seq 30674:32134, ack 18994, win 501, length 1460
21:41:47.642818 IP 192.168.137.1.12000 > 192.168.137.215.46640: Flags [.], ack 20454, win 256, length 0
21:41:47.642854 IP 192.168.137.1.12000 > 192.168.137.215.46640: Flags [P.], seq 18994:20454, ack 20454, win 256, length 1460
21:41:47.653665 IP 192.168.137.1.12000 > 192.168.137.215.46640: Flags [.], ack 21914, win 256, length 0
21:41:47.653702 IP 192.168.137.1.12000 > 192.168.137.215.46640: Flags [P.], seq 20454:21914, ack 21914, win 256, length 1460
21:41:47.653831 IP 192.168.137.215.46640 > 192.168.137.1.12000: Flags [.], ack 21914, win 501, length 0
21:41:47.658694 IP 192.168.137.215.46640 > 192.168.137.1.12000: Flags [.], seq 32134:33594, ack 21914, win 501, length 1460
21:41:47.658729 IP 192.168.137.215.46640 > 192.168.137.1.12000: Flags [.], seq 33594:35054, ack 21914, win 501, length 1460
21:41:47.658740 IP 192.168.137.215.46640 > 192.168.137.1.12000: Flags [P.], seq 35054:36514, ack 21914, win 501, length 1460
21:41:47.691472 IP 192.168.137.1.12000 > 192.168.137.215.46640: Flags [.], ack 21914, win 256, options [nop,nop,sack 1 {24834:26294}], length 0
21:41:47.691533 IP 192.168.137.215.46640 > 192.168.137.1.12000: Flags [.], seq 21914:23374, ack 21914, win 501, length 1460
21:41:47.691578 IP 192.168.137.1.12000 > 192.168.137.215.46640: Flags [.], ack 21914, win 256, options [nop,nop,sack 1 {24834:27754}], length 0
21:41:47.691597 IP 192.168.137.1.12000 > 192.168.137.215.46640: Flags [.], ack 21914, win 256, options [nop,nop,sack 1 {24834:29214}], length 0
21:41:47.697638 IP 192.168.137.215.46640 > 192.168.137.1.12000: Flags [.], seq 23374:24834, ack 21914, win 501, length 1460
21:41:47.726605 IP 192.168.137.1.12000 > 192.168.137.215.46640: Flags [.], ack 21914, win 256, options [nop,nop,sack 1 {24834:30674}], length 0
21:41:47.726662 IP 192.168.137.215.46640 > 192.168.137.1.12000: Flags [.], seq 36514:37974, ack 21914, win 501, length 1460
21:41:47.726705 IP 192.168.137.1.12000 > 192.168.137.215.46640: Flags [.], ack 21914, win 256, options [nop,nop,sack 1 {24834:32134}], length 0
21:41:47.726729 IP 192.168.137.215.46640 > 192.168.137.1.12000: Flags [.], seq 37974:39434, ack 21914, win 501, length 1460
21:41:47.726743 IP 192.168.137.1.12000 > 192.168.137.215.46640: Flags [.], ack 21914, win 256, options [nop,nop,sack 1 {24834:33594}], length 0
21:41:47.734102 IP 192.168.137.215.46640 > 192.168.137.1.12000: Flags [.], seq 39434:40894, ack 21914, win 501, length 1460
21:41:47.737801 IP 192.168.137.1.12000 > 192.168.137.215.46640: Flags [.], ack 21914, win 256, options [nop,nop,sack 1 {24834:35054}], length 0
21:41:47.737862 IP 192.168.137.215.46640 > 192.168.137.1.12000: Flags [.], seq 40894:42354, ack 21914, win 501, length 1460
21:41:47.737907 IP 192.168.137.1.12000 > 192.168.137.215.46640: Flags [.], ack 21914, win 256, options [nop,nop,sack 1 {24834:36514}], length 0
21:41:47.737923 IP 192.168.137.1.12000 > 192.168.137.215.46640: Flags [.], ack 23374, win 256, options [nop,nop,sack 1 {24834:36514}], length 0
21:41:47.737936 IP 192.168.137.1.12000 > 192.168.137.215.46640: Flags [P.], seq 21914:22938, ack 23374, win 256, length 1024
21:41:47.737973 IP 192.168.137.1.12000 > 192.168.137.215.46640: Flags [.], ack 36514, win 256, length 0
21:41:47.738003 IP 192.168.137.1.12000 > 192.168.137.215.46640: Flags [P.], seq 22938:24398, ack 36514, win 256, length 1460
21:41:47.738020 IP 192.168.137.1.12000 > 192.168.137.215.46640: Flags [P.], seq 24398:25858, ack 36514, win 256, length 1460
21:41:47.738031 IP 192.168.137.1.12000 > 192.168.137.215.46640: Flags [P.], seq 25858:26446, ack 36514, win 256, length 588
21:41:47.738089 IP 192.168.137.215.46640 > 192.168.137.1.12000: Flags [.], ack 26446, win 493, length 0
21:41:47.738132 IP 192.168.137.1.12000 > 192.168.137.215.46640: Flags [P.], seq 26446:27906, ack 36514, win 256, length 1460
21:41:47.738152 IP 192.168.137.1.12000 > 192.168.137.215.46640: Flags [P.], seq 27906:28494, ack 36514, win 256, length 588
21:41:47.738163 IP 192.168.137.1.12000 > 192.168.137.215.46640: Flags [P.], seq 28494:29954, ack 36514, win 256, length 1460
21:41:47.738176 IP 192.168.137.1.12000 > 192.168.137.215.46640: Flags [P.], seq 29954:30542, ack 36514, win 256, length 588
21:41:47.738195 IP 192.168.137.1.12000 > 192.168.137.215.46640: Flags [P.], seq 30542:32002, ack 36514, win 256, length 1460
21:41:47.738207 IP 192.168.137.1.12000 > 192.168.137.215.46640: Flags [P.], seq 32002:32590, ack 36514, win 256, length 588
21:41:47.738226 IP 192.168.137.1.12000 > 192.168.137.215.46640: Flags [P.], seq 32590:34050, ack 36514, win 256, length 1460
21:41:47.738248 IP 192.168.137.1.12000 > 192.168.137.215.46640: Flags [P.], seq 34050:34638, ack 36514, win 256, length 588
21:41:47.738312 IP 192.168.137.1.12000 > 192.168.137.215.46640: Flags [P.], seq 34638:36098, ack 36514, win 256, length 1460
21:41:47.738334 IP 192.168.137.1.12000 > 192.168.137.215.46640: Flags [P.], seq 36098:36514, ack 36514, win 256, length 416
21:41:47.738442 IP 192.168.137.215.46640 > 192.168.137.1.12000: Flags [.], ack 36514, win 415, length 0
21:41:47.743363 IP 192.168.137.215.46640 > 192.168.137.1.12000: Flags [.], seq 42354:43814, ack 36514, win 501, length 1460
21:41:47.744979 IP 192.168.137.215.46640 > 192.168.137.1.12000: Flags [.], seq 43814:45274, ack 36514, win 501, length 1460
21:41:47.745042 IP 192.168.137.215.46640 > 192.168.137.1.12000: Flags [.], seq 45274:46734, ack 36514, win 501, length 1460
21:41:47.745055 IP 192.168.137.215.46640 > 192.168.137.1.12000: Flags [P.], seq 46734:48194, ack 36514, win 501, length 1460
21:41:47.752914 IP 192.168.137.215.46640 > 192.168.137.1.12000: Flags [.], seq 48194:49654, ack 36514, win 501, length 1460
21:41:47.752947 IP 192.168.137.215.46640 > 192.168.137.1.12000: Flags [P.], seq 49654:51114, ack 36514, win 501, length 1460
21:41:47.757388 IP 192.168.137.215.46640 > 192.168.137.1.12000: Flags [.], seq 51114:52574, ack 36514, win 501, length 1460
21:41:47.757422 IP 192.168.137.215.46640 > 192.168.137.1.12000: Flags [P.], seq 52574:54034, ack 36514, win 501, length 1460
21:41:47.759795 IP 192.168.137.215.46640 > 192.168.137.1.12000: Flags [.], seq 54034:55494, ack 36514, win 501, length 1460
21:41:47.759829 IP 192.168.137.215.46640 > 192.168.137.1.12000: Flags [P.], seq 55494:56954, ack 36514, win 501, length 1460
21:41:47.771058 IP 192.168.137.215.46640 > 192.168.137.1.12000: Flags [.], seq 56954:58414, ack 36514, win 501, length 1460
21:41:47.771091 IP 192.168.137.215.46640 > 192.168.137.1.12000: Flags [P.], seq 58414:59874, ack 36514, win 501, length 1460
21:41:47.782784 IP 192.168.137.1.12000 > 192.168.137.215.46640: Flags [.], ack 37974, win 256, length 0
21:41:47.782841 IP 192.168.137.215.46640 > 192.168.137.1.12000: Flags [.], seq 59874:61334, ack 36514, win 501, length 1460
21:41:47.782892 IP 192.168.137.1.12000 > 192.168.137.215.46640: Flags [P.], seq 36514:37974, ack 37974, win 256, length 1460
21:41:47.782936 IP 192.168.137.1.12000 > 192.168.137.215.46640: Flags [.], ack 39434, win 256, length 0
21:41:47.782956 IP 192.168.137.1.12000 > 192.168.137.215.46640: Flags [P.], seq 37974:39434, ack 39434, win 256, length 1460
21:41:47.782967 IP 192.168.137.1.12000 > 192.168.137.215.46640: Flags [.], ack 40894, win 256, length 0
21:41:47.783006 IP 192.168.137.215.46640 > 192.168.137.1.12000: Flags [.], seq 61334:62794, ack 39434, win 479, length 1460
21:41:47.783027 IP 192.168.137.215.46640 > 192.168.137.1.12000: Flags [P.], seq 62794:64254, ack 39434, win 479, length 1460
21:41:47.783043 IP 192.168.137.1.12000 > 192.168.137.215.46640: Flags [P.], seq 39434:40894, ack 40894, win 256, length 1460
21:41:47.783050 IP 192.168.137.1.12000 > 192.168.137.215.46640: Flags [.], ack 42354, win 256, length 0
21:41:47.783058 IP 192.168.137.1.12000 > 192.168.137.215.46640: Flags [P.], seq 40894:42354, ack 42354, win 256, length 1460
21:41:47.783134 IP 192.168.137.215.46640 > 192.168.137.1.12000: Flags [.], ack 42354, win 477, length 0
21:41:47.791730 IP 192.168.137.1.12000 > 192.168.137.215.46640: Flags [.], ack 43814, win 256, length 0
21:41:47.791793 IP 192.168.137.215.46640 > 192.168.137.1.12000: Flags [.], seq 64254:65714, ack 42354, win 501, length 1460
21:41:47.791830 IP 192.168.137.215.46640 > 192.168.137.1.12000: Flags [P.], seq 65714:67174, ack 42354, win 501, length 1460
21:41:47.791853 IP 192.168.137.1.12000 > 192.168.137.215.46640: Flags [P.], seq 42354:43814, ack 43814, win 256, length 1460
21:41:47.791890 IP 192.168.137.1.12000 > 192.168.137.215.46640: Flags [.], ack 45274, win 256, length 0
21:41:47.791907 IP 192.168.137.1.12000 > 192.168.137.215.46640: Flags [P.], seq 43814:45274, ack 45274, win 256, length 1460
21:41:47.791917 IP 192.168.137.1.12000 > 192.168.137.215.46640: Flags [.], ack 46734, win 256, length 0
21:41:47.791977 IP 192.168.137.215.46640 > 192.168.137.1.12000: Flags [.], seq 67174:68634, ack 45274, win 479, length 1460
21:41:47.791997 IP 192.168.137.215.46640 > 192.168.137.1.12000: Flags [P.], seq 68634:70094, ack 45274, win 479, length 1460
21:41:47.792016 IP 192.168.137.1.12000 > 192.168.137.215.46640: Flags [P.], seq 45274:46734, ack 46734, win 256, length 1460
21:41:47.792026 IP 192.168.137.1.12000 > 192.168.137.215.46640: Flags [.], ack 48194, win 256, length 0
21:41:47.792038 IP 192.168.137.1.12000 > 192.168.137.215.46640: Flags [P.], seq 46734:48194, ack 48194, win 256, length 1460
21:41:47.792133 IP 192.168.137.1.12000 > 192.168.137.215.46640: Flags [.], ack 49654, win 256, length 0
21:41:47.792159 IP 192.168.137.1.12000 > 192.168.137.215.46640: Flags [P.], seq 48194:49654, ack 49654, win 256, length 1460
21:41:47.792167 IP 192.168.137.1.12000 > 192.168.137.215.46640: Flags [.], ack 51114, win 256, length 0
21:41:47.792178 IP 192.168.137.1.12000 > 192.168.137.215.46640: Flags [P.], seq 49654:51114, ack 51114, win 256, length 1460
21:41:47.792185 IP 192.168.137.1.12000 > 192.168.137.215.46640: Flags [.], ack 52574, win 256, length 0
21:41:47.792193 IP 192.168.137.1.12000 > 192.168.137.215.46640: Flags [P.], seq 51114:52574, ack 52574, win 256, length 1460
21:41:47.792201 IP 192.168.137.1.12000 > 192.168.137.215.46640: Flags [.], ack 54034, win 256, length 0
21:41:47.792206 IP 192.168.137.215.46640 > 192.168.137.1.12000: Flags [.], ack 48194, win 457, length 0
21:41:47.792556 IP 192.168.137.215.46640 > 192.168.137.1.12000: Flags [.], ack 52574, win 429, length 0
21:41:47.792716 IP 192.168.137.1.12000 > 192.168.137.215.46640: Flags [P.], seq 52574:54034, ack 54034, win 256, length 1460
21:41:47.792746 IP 192.168.137.1.12000 > 192.168.137.215.46640: Flags [.], ack 55494, win 256, length 0
21:41:47.792770 IP 192.168.137.1.12000 > 192.168.137.215.46640: Flags [P.], seq 54034:55494, ack 55494, win 256, length 1460
21:41:47.792778 IP 192.168.137.1.12000 > 192.168.137.215.46640: Flags [.], ack 56954, win 256, length 0
21:41:47.792785 IP 192.168.137.1.12000 > 192.168.137.215.46640: Flags [P.], seq 55494:56954, ack 56954, win 256, length 1460
21:41:47.792791 IP 192.168.137.1.12000 > 192.168.137.215.46640: Flags [.], ack 58414, win 256, length 0
21:41:47.792799 IP 192.168.137.1.12000 > 192.168.137.215.46640: Flags [P.], seq 56954:58414, ack 58414, win 256, length 1460
21:41:47.792805 IP 192.168.137.1.12000 > 192.168.137.215.46640: Flags [.], ack 59874, win 256, length 0
21:41:47.792858 IP 192.168.137.1.12000 > 192.168.137.215.46640: Flags [P.], seq 58414:59874, ack 59874, win 256, length 1460
21:41:47.792872 IP 192.168.137.1.12000 > 192.168.137.215.46640: Flags [.], ack 61334, win 256, length 0
21:41:47.792879 IP 192.168.137.1.12000 > 192.168.137.215.46640: Flags [P.], seq 59874:61334, ack 61334, win 256, length 1460
21:41:47.792933 IP 192.168.137.215.46640 > 192.168.137.1.12000: Flags [.], ack 61334, win 361, length 0
21:41:47.807859 IP 192.168.137.215.46640 > 192.168.137.1.12000: Flags [.], seq 70094:71554, ack 61334, win 501, length 1460
21:41:47.807893 IP 192.168.137.215.46640 > 192.168.137.1.12000: Flags [P.], seq 71554:73014, ack 61334, win 501, length 1460
21:41:47.809810 IP 192.168.137.215.46640 > 192.168.137.1.12000: Flags [.], seq 73014:74474, ack 61334, win 501, length 1460
21:41:47.809844 IP 192.168.137.215.46640 > 192.168.137.1.12000: Flags [.], seq 74474:75934, ack 61334, win 501, length 1460
21:41:47.809855 IP 192.168.137.215.46640 > 192.168.137.1.12000: Flags [P.], seq 75934:77394, ack 61334, win 501, length 1460
21:41:47.820553 IP 192.168.137.215.46640 > 192.168.137.1.12000: Flags [.], seq 77394:78854, ack 61334, win 501, length 1460
21:41:47.820587 IP 192.168.137.215.46640 > 192.168.137.1.12000: Flags [.], seq 78854:80314, ack 61334, win 501, length 1460
21:41:47.820598 IP 192.168.137.215.46640 > 192.168.137.1.12000: Flags [.], seq 80314:81774, ack 61334, win 501, length 1460
21:41:47.820607 IP 192.168.137.215.46640 > 192.168.137.1.12000: Flags [P.], seq 81774:83234, ack 61334, win 501, length 1460
21:41:47.825498 IP 192.168.137.1.12000 > 192.168.137.215.46640: Flags [.], ack 62794, win 256, length 0
21:41:47.825539 IP 192.168.137.1.12000 > 192.168.137.215.46640: Flags [P.], seq 61334:62794, ack 62794, win 256, length 1460
21:41:47.825577 IP 192.168.137.1.12000 > 192.168.137.215.46640: Flags [.], ack 64254, win 256, length 0
21:41:47.825596 IP 192.168.137.1.12000 > 192.168.137.215.46640: Flags [P.], seq 62794:64254, ack 64254, win 256, length 1460
21:41:47.825695 IP 192.168.137.215.46640 > 192.168.137.1.12000: Flags [.], ack 64254, win 501, length 0
21:41:47.833990 IP 192.168.137.215.46640 > 192.168.137.1.12000: Flags [.], seq 83234:84694, ack 64254, win 501, length 1460
21:41:47.834023 IP 192.168.137.215.46640 > 192.168.137.1.12000: Flags [.], seq 84694:86154, ack 64254, win 501, length 1460
21:41:47.834034 IP 192.168.137.215.46640 > 192.168.137.1.12000: Flags [P.], seq 86154:87614, ack 64254, win 501, length 1460
21:41:47.852084 IP 192.168.137.1.12000 > 192.168.137.215.46640: Flags [.], ack 65714, win 256, length 0
21:41:47.852150 IP 192.168.137.215.46640 > 192.168.137.1.12000: Flags [.], seq 87614:89074, ack 64254, win 501, length 1460
21:41:47.852187 IP 192.168.137.215.46640 > 192.168.137.1.12000: Flags [P.], seq 89074:90534, ack 64254, win 501, length 1460
21:41:47.852208 IP 192.168.137.1.12000 > 192.168.137.215.46640: Flags [P.], seq 64254:65714, ack 65714, win 256, length 1460
21:41:47.852244 IP 192.168.137.1.12000 > 192.168.137.215.46640: Flags [.], ack 67174, win 256, length 0
21:41:47.852262 IP 192.168.137.1.12000 > 192.168.137.215.46640: Flags [P.], seq 65714:67174, ack 67174, win 256, length 1460
21:41:47.852273 IP 192.168.137.1.12000 > 192.168.137.215.46640: Flags [.], ack 68634, win 256, length 0
21:41:47.852285 IP 192.168.137.1.12000 > 192.168.137.215.46640: Flags [P.], seq 67174:68634, ack 68634, win 256, length 1460
21:41:47.852299 IP 192.168.137.1.12000 > 192.168.137.215.46640: Flags [.], ack 70094, win 256, length 0
21:41:47.852343 IP 192.168.137.215.46640 > 192.168.137.1.12000: Flags [.], seq 90534:91994, ack 68634, win 467, length 1460
21:41:47.852360 IP 192.168.137.215.46640 > 192.168.137.1.12000: Flags [.], seq 91994:93454, ack 68634, win 467, length 1460
21:41:47.852372 IP 192.168.137.215.46640 > 192.168.137.1.12000: Flags [P.], seq 93454:94914, ack 68634, win 467, length 1460
21:41:47.852388 IP 192.168.137.1.12000 > 192.168.137.215.46640: Flags [P.], seq 68634:70094, ack 70094, win 256, length 1460
21:41:47.852497 IP 192.168.137.1.12000 > 192.168.137.215.46640: Flags [.], ack 75934, win 256, length 0
21:41:47.852516 IP 192.168.137.1.12000 > 192.168.137.215.46640: Flags [P.], seq 70094:71554, ack 75934, win 256, length 1460
21:41:47.852534 IP 192.168.137.215.46640 > 192.168.137.1.12000: Flags [.], ack 71554, win 547, length 0
21:41:47.852568 IP 192.168.137.1.12000 > 192.168.137.215.46640: Flags [P.], seq 71554:72142, ack 75934, win 256, length 588
21:41:47.852586 IP 192.168.137.1.12000 > 192.168.137.215.46640: Flags [P.], seq 72142:73602, ack 75934, win 256, length 1460
21:41:47.852607 IP 192.168.137.215.46640 > 192.168.137.1.12000: Flags [.], ack 73602, win 592, length 0
21:41:47.852631 IP 192.168.137.1.12000 > 192.168.137.215.46640: Flags [P.], seq 73602:74190, ack 75934, win 256, length 588
21:41:47.852646 IP 192.168.137.1.12000 > 192.168.137.215.46640: Flags [P.], seq 74190:75650, ack 75934, win 256, length 1460
21:41:47.852667 IP 192.168.137.215.46640 > 192.168.137.1.12000: Flags [.], ack 75650, win 638, length 0
21:41:47.852692 IP 192.168.137.1.12000 > 192.168.137.215.46640: Flags [P.], seq 75650:75934, ack 75934, win 256, length 284
21:41:47.852716 IP 192.168.137.1.12000 > 192.168.137.215.46640: Flags [.], ack 81774, win 256, length 0
21:41:47.852850 IP 192.168.137.1.12000 > 192.168.137.215.46640: Flags [P.], seq 75934:77394, ack 81774, win 256, length 1460
21:41:47.852875 IP 192.168.137.215.46640 > 192.168.137.1.12000: Flags [.], ack 77394, win 684, length 0
21:41:47.852903 IP 192.168.137.1.12000 > 192.168.137.215.46640: Flags [P.], seq 77394:77982, ack 81774, win 256, length 588
21:41:47.852918 IP 192.168.137.1.12000 > 192.168.137.215.46640: Flags [P.], seq 77982:79442, ack 81774, win 256, length 1460
21:41:47.852929 IP 192.168.137.1.12000 > 192.168.137.215.46640: Flags [P.], seq 79442:80030, ack 81774, win 256, length 588
21:41:47.852938 IP 192.168.137.1.12000 > 192.168.137.215.46640: Flags [P.], seq 80030:81490, ack 81774, win 256, length 1460
21:41:47.852961 IP 192.168.137.215.46640 > 192.168.137.1.12000: Flags [.], ack 79442, win 729, length 0
21:41:47.853017 IP 192.168.137.215.46640 > 192.168.137.1.12000: Flags [.], ack 81490, win 775, length 0
21:41:47.853046 IP 192.168.137.1.12000 > 192.168.137.215.46640: Flags [P.], seq 81490:81774, ack 81774, win 256, length 284
21:41:47.853063 IP 192.168.137.1.12000 > 192.168.137.215.46640: Flags [.], ack 87614, win 256, length 0
21:41:47.853070 IP 192.168.137.1.12000 > 192.168.137.215.46640: Flags [P.], seq 81774:83234, ack 87614, win 256, length 1460
21:41:47.853077 IP 192.168.137.1.12000 > 192.168.137.215.46640: Flags [P.], seq 83234:83822, ack 87614, win 256, length 588
21:41:47.853084 IP 192.168.137.1.12000 > 192.168.137.215.46640: Flags [P.], seq 83822:85282, ack 87614, win 256, length 1460
21:41:47.853093 IP 192.168.137.1.12000 > 192.168.137.215.46640: Flags [P.], seq 85282:85870, ack 87614, win 256, length 588
21:41:47.853100 IP 192.168.137.1.12000 > 192.168.137.215.46640: Flags [P.], seq 85870:87330, ack 87614, win 256, length 1460
21:41:47.853106 IP 192.168.137.1.12000 > 192.168.137.215.46640: Flags [P.], seq 87330:87614, ack 87614, win 256, length 284
21:41:47.853110 IP 192.168.137.215.46640 > 192.168.137.1.12000: Flags [.], ack 83234, win 820, length 0
21:41:47.853157 IP 192.168.137.215.46640 > 192.168.137.1.12000: Flags [.], ack 85282, win 866, length 0
21:41:47.853190 IP 192.168.137.215.46640 > 192.168.137.1.12000: Flags [.], ack 87330, win 912, length 0
21:41:47.856337 IP 192.168.137.215.46640 > 192.168.137.1.12000: Flags [.], seq 94914:96374, ack 87614, win 935, length 1460
21:41:47.856372 IP 192.168.137.215.46640 > 192.168.137.1.12000: Flags [.], seq 96374:97834, ack 87614, win 935, length 1460
21:41:47.856388 IP 192.168.137.215.46640 > 192.168.137.1.12000: Flags [P.], seq 97834:99294, ack 87614, win 935, length 1460
21:41:47.856438 IP 192.168.137.215.46640 > 192.168.137.1.12000: Flags [.], seq 99294:100754, ack 87614, win 935, length 1460
21:41:47.856458 IP 192.168.137.215.46640 > 192.168.137.1.12000: Flags [.], seq 100754:102214, ack 87614, win 935, length 1460
21:41:47.856473 IP 192.168.137.215.46640 > 192.168.137.1.12000: Flags [P.], seq 102214:103674, ack 87614, win 935, length 1460
21:41:47.861049 IP 192.168.137.215.46640 > 192.168.137.1.12000: Flags [.], seq 103674:105134, ack 87614, win 935, length 1460
21:41:47.861082 IP 192.168.137.215.46640 > 192.168.137.1.12000: Flags [.], seq 105134:106594, ack 87614, win 935, length 1460
21:41:47.861091 IP 192.168.137.215.46640 > 192.168.137.1.12000: Flags [P.], seq 106594:108054, ack 87614, win 935, length 1460
21:41:47.875198 IP 192.168.137.1.12000 > 192.168.137.215.46640: Flags [.], ack 94914, win 256, length 0
21:41:47.875234 IP 192.168.137.1.12000 > 192.168.137.215.46640: Flags [P.], seq 87614:89074, ack 94914, win 256, length 1460
21:41:47.875291 IP 192.168.137.1.12000 > 192.168.137.215.46640: Flags [P.], seq 89074:89662, ack 94914, win 256, length 588
21:41:47.875300 IP 192.168.137.1.12000 > 192.168.137.215.46640: Flags [P.], seq 89662:91122, ack 94914, win 256, length 1460
21:41:47.875351 IP 192.168.137.215.46640 > 192.168.137.1.12000: Flags [.], ack 89662, win 980, length 0
21:41:47.876870 IP 192.168.137.215.46640 > 192.168.137.1.12000: Flags [P.], seq 108054:109514, ack 91122, win 1003, length 1460
21:41:47.876933 IP 192.168.137.215.46640 > 192.168.137.1.12000: Flags [.], seq 109514:110974, ack 91122, win 1003, length 1460
21:41:47.876944 IP 192.168.137.215.46640 > 192.168.137.1.12000: Flags [.], seq 110974:112434, ack 91122, win 1003, length 1460
21:41:47.876954 IP 192.168.137.215.46640 > 192.168.137.1.12000: Flags [.], seq 112434:113894, ack 91122, win 1003, length 1460
21:41:47.876964 IP 192.168.137.215.46640 > 192.168.137.1.12000: Flags [P.], seq 113894:115354, ack 91122, win 1003, length 1460
21:41:47.876992 IP 192.168.137.215.46640 > 192.168.137.1.12000: Flags [.], seq 115354:116814, ack 91122, win 1003, length 1460
21:41:47.877001 IP 192.168.137.215.46640 > 192.168.137.1.12000: Flags [.], seq 116814:118274, ack 91122, win 1003, length 1460
21:41:47.877010 IP 192.168.137.215.46640 > 192.168.137.1.12000: Flags [.], seq 118274:119734, ack 91122, win 1003, length 1460
21:41:47.877020 IP 192.168.137.215.46640 > 192.168.137.1.12000: Flags [P.], seq 119734:121194, ack 91122, win 1003, length 1460
21:41:47.900218 IP 192.168.137.1.12000 > 192.168.137.215.46640: Flags [P.], seq 91122:91710, ack 94914, win 256, length 588
21:41:47.900241 IP 192.168.137.1.12000 > 192.168.137.215.46640: Flags [P.], seq 91710:93170, ack 94914, win 256, length 1460
21:41:47.900254 IP 192.168.137.215.46640 > 192.168.137.1.12000: Flags [.], ack 93170, win 1049, length 0
21:41:47.900275 IP 192.168.137.1.12000 > 192.168.137.215.46640: Flags [P.], seq 93170:93758, ack 94914, win 256, length 588
21:41:47.900279 IP 192.168.137.1.12000 > 192.168.137.215.46640: Flags [P.], seq 93758:94914, ack 94914, win 256, length 1156
21:41:47.900282 IP 192.168.137.1.12000 > 192.168.137.215.46640: Flags [.], ack 103674, win 256, length 0
21:41:47.900285 IP 192.168.137.1.12000 > 192.168.137.215.46640: Flags [P.], seq 94914:96374, ack 103674, win 256, length 1460
21:41:47.900288 IP 192.168.137.1.12000 > 192.168.137.215.46640: Flags [P.], seq 96374:96962, ack 103674, win 256, length 588
21:41:47.900290 IP 192.168.137.1.12000 > 192.168.137.215.46640: Flags [P.], seq 96962:98422, ack 103674, win 256, length 1460
21:41:47.900298 IP 192.168.137.215.46640 > 192.168.137.1.12000: Flags [.], ack 94914, win 1094, length 0
21:41:47.900311 IP 192.168.137.1.12000 > 192.168.137.215.46640: Flags [P.], seq 98422:99010, ack 103674, win 256, length 588
21:41:47.900313 IP 192.168.137.1.12000 > 192.168.137.215.46640: Flags [P.], seq 99010:100470, ack 103674, win 256, length 1460
21:41:47.900323 IP 192.168.137.1.12000 > 192.168.137.215.46640: Flags [P.], seq 100470:101058, ack 103674, win 256, length 588
21:41:47.900325 IP 192.168.137.1.12000 > 192.168.137.215.46640: Flags [P.], seq 101058:102518, ack 103674, win 256, length 1460
21:41:47.900327 IP 192.168.137.1.12000 > 192.168.137.215.46640: Flags [P.], seq 102518:103106, ack 103674, win 256, length 588
21:41:47.900329 IP 192.168.137.1.12000 > 192.168.137.215.46640: Flags [P.], seq 103106:103674, ack 108054, win 256, length 568
21:41:47.900331 IP 192.168.137.1.12000 > 192.168.137.215.46640: Flags [P.], seq 103674:105134, ack 108054, win 256, length 1460
21:41:47.900333 IP 192.168.137.1.12000 > 192.168.137.215.46640: Flags [P.], seq 105134:105722, ack 108054, win 256, length 588
21:41:47.900343 IP 192.168.137.215.46640 > 192.168.137.1.12000: Flags [.], seq 121194:122654, ack 94914, win 1094, length 1460
21:41:47.900350 IP 192.168.137.1.12000 > 192.168.137.215.46640: Flags [P.], seq 105722:107182, ack 108054, win 256, length 1460
21:41:47.900352 IP 192.168.137.215.46640 > 192.168.137.1.12000: Flags [.], seq 122654:124114, ack 94914, win 1094, length 1460
21:41:47.900353 IP 192.168.137.1.12000 > 192.168.137.215.46640: Flags [P.], seq 107182:107770, ack 108054, win 256, length 588
21:41:47.900355 IP 192.168.137.1.12000 > 192.168.137.215.46640: Flags [P.], seq 107770:109078, ack 119734, win 256, length 1308
21:41:47.900357 IP 192.168.137.1.12000 > 192.168.137.215.46640: Flags [P.], seq 109078:110538, ack 119734, win 256, length 1460
21:41:47.900359 IP 192.168.137.215.46640 > 192.168.137.1.12000: Flags [P.], seq 124114:125574, ack 94914, win 1094, length 1460
21:41:47.900359 IP 192.168.137.1.12000 > 192.168.137.215.46640: Flags [P.], seq 110538:111998, ack 119734, win 256, length 1460
21:41:47.900376 IP 192.168.137.215.46640 > 192.168.137.1.12000: Flags [.], seq 125574:127034, ack 94914, win 1094, length 1460
21:41:47.900383 IP 192.168.137.215.46640 > 192.168.137.1.12000: Flags [.], seq 127034:128494, ack 94914, win 1094, length 1460
21:41:47.900388 IP 192.168.137.215.46640 > 192.168.137.1.12000: Flags [P.], seq 128494:129954, ack 94914, win 1094, length 1460
21:41:47.900402 IP 192.168.137.215.46640 > 192.168.137.1.12000: Flags [.], ack 96962, win 1140, length 0
21:41:47.900422 IP 192.168.137.215.46640 > 192.168.137.1.12000: Flags [.], ack 111998, win 1375, length 0
21:41:47.900458 IP 192.168.137.1.12000 > 192.168.137.215.46640: Flags [P.], seq 111998:113174, ack 119734, win 256, length 1176
21:41:47.900465 IP 192.168.137.1.12000 > 192.168.137.215.46640: Flags [P.], seq 113174:114634, ack 119734, win 256, length 1460
21:41:47.900472 IP 192.168.137.215.46640 > 192.168.137.1.12000: Flags [.], ack 114634, win 1420, length 0
21:41:47.900483 IP 192.168.137.1.12000 > 192.168.137.215.46640: Flags [P.], seq 114634:116094, ack 119734, win 256, length 1460
21:41:47.900486 IP 192.168.137.1.12000 > 192.168.137.215.46640: Flags [P.], seq 116094:116246, ack 119734, win 256, length 152
21:41:47.900495 IP 192.168.137.215.46640 > 192.168.137.1.12000: Flags [.], ack 116246, win 1466, length 0
21:41:47.900502 IP 192.168.137.1.12000 > 192.168.137.215.46640: Flags [P.], seq 116246:117706, ack 119734, win 256, length 1460
21:41:47.900507 IP 192.168.137.1.12000 > 192.168.137.215.46640: Flags [P.], seq 117706:118294, ack 119734, win 256, length 588
21:41:47.900510 IP 192.168.137.1.12000 > 192.168.137.215.46640: Flags [P.], seq 118294:119734, ack 121194, win 256, length 1440
21:41:47.900512 IP 192.168.137.1.12000 > 192.168.137.215.46640: Flags [P.], seq 119734:121194, ack 121194, win 256, length 1460
21:41:47.900516 IP 192.168.137.215.46640 > 192.168.137.1.12000: Flags [.], ack 118294, win 1512, length 0
21:41:47.900541 IP 192.168.137.215.46640 > 192.168.137.1.12000: Flags [.], ack 121194, win 1557, length 0
21:41:47.907581 IP 192.168.137.215.46640 > 192.168.137.1.12000: Flags [.], seq 129954:131414, ack 121194, win 1557, length 1460
21:41:47.907598 IP 192.168.137.215.46640 > 192.168.137.1.12000: Flags [.], seq 131414:132874, ack 121194, win 1557, length 1460
21:41:47.907604 IP 192.168.137.215.46640 > 192.168.137.1.12000: Flags [.], seq 132874:134334, ack 121194, win 1557, length 1460
21:41:47.907607 IP 192.168.137.215.46640 > 192.168.137.1.12000: Flags [P.], seq 134334:135794, ack 121194, win 1557, length 1460
21:41:47.907623 IP 192.168.137.215.46640 > 192.168.137.1.12000: Flags [.], seq 135794:137254, ack 121194, win 1557, length 1460
21:41:47.907628 IP 192.168.137.215.46640 > 192.168.137.1.12000: Flags [.], seq 137254:138714, ack 121194, win 1557, length 1460
21:41:47.907633 IP 192.168.137.215.46640 > 192.168.137.1.12000: Flags [.], seq 138714:140174, ack 121194, win 1557, length 1460
21:41:47.907636 IP 192.168.137.215.46640 > 192.168.137.1.12000: Flags [P.], seq 140174:141634, ack 121194, win 1557, length 1460
21:41:47.914916 IP 192.168.137.215.46640 > 192.168.137.1.12000: Flags [.], seq 141634:143094, ack 121194, win 1557, length 1460
21:41:47.914932 IP 192.168.137.215.46640 > 192.168.137.1.12000: Flags [.], seq 143094:144554, ack 121194, win 1557, length 1460
21:41:47.914936 IP 192.168.137.215.46640 > 192.168.137.1.12000: Flags [.], seq 144554:146014, ack 121194, win 1557, length 1460
21:41:47.914940 IP 192.168.137.215.46640 > 192.168.137.1.12000: Flags [P.], seq 146014:147474, ack 121194, win 1557, length 1460
21:41:47.924055 IP 192.168.137.1.12000 > 192.168.137.215.46640: Flags [P.], seq 121194:122218, ack 129954, win 256, length 1024
21:41:47.924087 IP 192.168.137.215.46640 > 192.168.137.1.12000: Flags [.], seq 147474:148934, ack 122218, win 1580, length 1460
21:41:47.924104 IP 192.168.137.215.46640 > 192.168.137.1.12000: Flags [.], seq 148934:150394, ack 122218, win 1580, length 1460
21:41:47.924108 IP 192.168.137.215.46640 > 192.168.137.1.12000: Flags [.], seq 150394:151854, ack 122218, win 1580, length 1460
21:41:47.924112 IP 192.168.137.215.46640 > 192.168.137.1.12000: Flags [P.], seq 151854:153314, ack 122218, win 1580, length 1460
21:41:47.924138 IP 192.168.137.1.12000 > 192.168.137.215.46640: Flags [P.], seq 122218:123678, ack 129954, win 256, length 1460
21:41:47.924145 IP 192.168.137.1.12000 > 192.168.137.215.46640: Flags [P.], seq 123678:124266, ack 129954, win 256, length 588
21:41:47.924153 IP 192.168.137.215.46640 > 192.168.137.1.12000: Flags [.], ack 124266, win 1626, length 0
21:41:47.925527 IP 192.168.137.215.46640 > 192.168.137.1.12000: Flags [.], seq 153314:154774, ack 124266, win 1626, length 1460
21:41:47.925543 IP 192.168.137.215.46640 > 192.168.137.1.12000: Flags [P.], seq 154774:156234, ack 124266, win 1626, length 1460
21:41:47.936623 IP 192.168.137.1.12000 > 192.168.137.215.46640: Flags [P.], seq 124266:125726, ack 129954, win 256, length 1460
21:41:47.936650 IP 192.168.137.1.12000 > 192.168.137.215.46640: Flags [P.], seq 125726:126314, ack 129954, win 256, length 588
21:41:47.936665 IP 192.168.137.215.46640 > 192.168.137.1.12000: Flags [.], ack 126314, win 1671, length 0
21:41:47.936691 IP 192.168.137.1.12000 > 192.168.137.215.46640: Flags [P.], seq 126314:127774, ack 129954, win 256, length 1460
21:41:47.936697 IP 192.168.137.1.12000 > 192.168.137.215.46640: Flags [P.], seq 127774:128362, ack 129954, win 256, length 588
21:41:47.936704 IP 192.168.137.215.46640 > 192.168.137.1.12000: Flags [.], ack 128362, win 1717, length 0
21:41:47.936719 IP 192.168.137.1.12000 > 192.168.137.215.46640: Flags [P.], seq 128362:129822, ack 129954, win 256, length 1460
21:41:47.936724 IP 192.168.137.1.12000 > 192.168.137.215.46640: Flags [P.], seq 129822:129954, ack 129954, win 256, length 132
21:41:47.936732 IP 192.168.137.215.46640 > 192.168.137.1.12000: Flags [.], ack 129954, win 1740, length 0
21:41:47.936745 IP 192.168.137.1.12000 > 192.168.137.215.46640: Flags [.], ack 140174, win 256, length 0
21:41:47.936750 IP 192.168.137.1.12000 > 192.168.137.215.46640: Flags [P.], seq 129954:131414, ack 140174, win 256, length 1460
21:41:47.936789 IP 192.168.137.1.12000 > 192.168.137.215.46640: Flags [P.], seq 131414:132002, ack 140174, win 256, length 588
21:41:47.936792 IP 192.168.137.1.12000 > 192.168.137.215.46640: Flags [P.], seq 132002:133462, ack 140174, win 256, length 1460
21:41:47.936795 IP 192.168.137.1.12000 > 192.168.137.215.46640: Flags [P.], seq 133462:134050, ack 140174, win 256, length 588
21:41:47.936797 IP 192.168.137.1.12000 > 192.168.137.215.46640: Flags [P.], seq 134050:135510, ack 140174, win 256, length 1460
21:41:47.936800 IP 192.168.137.1.12000 > 192.168.137.215.46640: Flags [P.], seq 135510:136098, ack 140174, win 256, length 588
21:41:47.936801 IP 192.168.137.215.46640 > 192.168.137.1.12000: Flags [.], seq 156234:157694, ack 129954, win 1740, length 1460
21:41:47.936802 IP 192.168.137.1.12000 > 192.168.137.215.46640: Flags [P.], seq 136098:137558, ack 140174, win 256, length 1460
21:41:47.936824 IP 192.168.137.215.46640 > 192.168.137.1.12000: Flags [.], seq 157694:159154, ack 129954, win 1740, length 1460
21:41:47.936833 IP 192.168.137.215.46640 > 192.168.137.1.12000: Flags [.], seq 159154:160614, ack 129954, win 1740, length 1460
21:41:47.936841 IP 192.168.137.215.46640 > 192.168.137.1.12000: Flags [P.], seq 160614:162074, ack 129954, win 1740, length 1460
21:41:47.936866 IP 192.168.137.215.46640 > 192.168.137.1.12000: Flags [.], ack 132002, win 1785, length 0
21:41:47.936883 IP 192.168.137.215.46640 > 192.168.137.1.12000: Flags [.], ack 134050, win 1831, length 0
21:41:47.936897 IP 192.168.137.215.46640 > 192.168.137.1.12000: Flags [.], ack 136098, win 1877, length 0
21:41:47.937689 IP 192.168.137.1.12000 > 192.168.137.215.46640: Flags [P.], seq 137558:138146, ack 140174, win 256, length 588
