21:17:57.619948 IP 192.168.137.215.46516 > 192.168.137.1.12000: Flags [S], seq 2466232656, win 64240, options [mss 1460,sackOK,TS val 592949152 ecr 0,nop,wscale 7], length 0
21:17:57.719315 IP 192.168.137.1.12000 > 192.168.137.215.46516: Flags [S.], seq 233951217, ack 2466232657, win 65535, options [mss 1460,nop,wscale 8,nop,nop,sackOK], length 0
21:17:57.719342 IP 192.168.137.215.46516 > 192.168.137.1.12000: Flags [.], ack 1, win 502, length 0
21:17:57.719573 IP 192.168.137.215.46516 > 192.168.137.1.12000: Flags [P.], seq 1:14, ack 1, win 502, length 13
21:17:57.719713 IP 192.168.137.215.46516 > 192.168.137.1.12000: Flags [.], seq 14:1474, ack 1, win 502, length 1460
21:17:57.719925 IP 192.168.137.215.46516 > 192.168.137.1.12000: Flags [.], seq 1474:2934, ack 1, win 502, length 1460
21:17:57.720259 IP 192.168.137.215.46516 > 192.168.137.1.12000: Flags [.], seq 2934:4394, ack 1, win 502, length 1460
21:17:57.720264 IP 192.168.137.215.46516 > 192.168.137.1.12000: Flags [P.], seq 4394:5854, ack 1, win 502, length 1460
21:17:57.797011 IP 192.168.137.215.46516 > 192.168.137.1.12000: Flags [.], seq 5854:7314, ack 1, win 502, length 1460
21:17:57.797096 IP 192.168.137.215.46516 > 192.168.137.1.12000: Flags [.], seq 7314:8774, ack 1, win 502, length 1460
21:17:57.797117 IP 192.168.137.215.46516 > 192.168.137.1.12000: Flags [P.], seq 8774:10234, ack 1, win 502, length 1460
21:17:57.812496 IP 192.168.137.215.46516 > 192.168.137.1.12000: Flags [.], seq 10234:11694, ack 1, win 502, length 1460
21:17:57.812529 IP 192.168.137.215.46516 > 192.168.137.1.12000: Flags [P.], seq 11694:13154, ack 1, win 502, length 1460
21:17:58.025509 IP 192.168.137.215.46516 > 192.168.137.1.12000: Flags [.], seq 13154:14614, ack 1, win 502, length 1460
21:17:58.101844 IP 192.168.137.1.12000 > 192.168.137.215.46516: Flags [P.], seq 1:14, ack 14, win 256, length 13
21:17:58.101938 IP 192.168.137.215.46516 > 192.168.137.1.12000: Flags [.], seq 14614:16074, ack 14, win 502, length 1460
21:17:58.101999 IP 192.168.137.1.12000 > 192.168.137.215.46516: Flags [.], ack 1474, win 256, length 0
21:17:58.102010 IP 192.168.137.1.12000 > 192.168.137.215.46516: Flags [P.], seq 14:1474, ack 1474, win 256, length 1460
21:17:58.102018 IP 192.168.137.1.12000 > 192.168.137.215.46516: Flags [.], ack 2934, win 256, length 0
21:17:58.102027 IP 192.168.137.1.12000 > 192.168.137.215.46516: Flags [P.], seq 1474:2934, ack 2934, win 256, length 1460
21:17:58.102036 IP 192.168.137.1.12000 > 192.168.137.215.46516: Flags [.], ack 4394, win 256, length 0
21:17:58.102045 IP 192.168.137.1.12000 > 192.168.137.215.46516: Flags [P.], seq 2934:4394, ack 4394, win 256, length 1460
21:17:58.102052 IP 192.168.137.1.12000 > 192.168.137.215.46516: Flags [.], ack 5854, win 256, length 0
21:17:58.102070 IP 192.168.137.215.46516 > 192.168.137.1.12000: Flags [.], seq 16074:17534, ack 14, win 502, length 1460
21:17:58.102142 IP 192.168.137.215.46516 > 192.168.137.1.12000: Flags [P.], seq 17534:18994, ack 14, win 502, length 1460
21:17:58.102167 IP 192.168.137.1.12000 > 192.168.137.215.46516: Flags [P.], seq 4394:5854, ack 5854, win 256, length 1460
21:17:58.102179 IP 192.168.137.1.12000 > 192.168.137.215.46516: Flags [.], ack 7314, win 256, length 0
21:17:58.102187 IP 192.168.137.1.12000 > 192.168.137.215.46516: Flags [P.], seq 5854:7314, ack 7314, win 256, length 1460
21:17:58.102196 IP 192.168.137.1.12000 > 192.168.137.215.46516: Flags [.], ack 8774, win 256, length 0
21:17:58.102205 IP 192.168.137.1.12000 > 192.168.137.215.46516: Flags [P.], seq 7314:8774, ack 8774, win 256, length 1460
21:17:58.102212 IP 192.168.137.215.46516 > 192.168.137.1.12000: Flags [.], ack 1474, win 491, length 0
21:17:58.102214 IP 192.168.137.1.12000 > 192.168.137.215.46516: Flags [.], ack 10234, win 256, length 0
21:17:58.102249 IP 192.168.137.215.46516 > 192.168.137.1.12000: Flags [.], seq 18994:20454, ack 1474, win 491, length 1460
21:17:58.102261 IP 192.168.137.215.46516 > 192.168.137.1.12000: Flags [P.], seq 20454:21914, ack 1474, win 491, length 1460
21:17:58.102285 IP 192.168.137.215.46516 > 192.168.137.1.12000: Flags [.], ack 2934, win 480, length 0
21:17:58.102309 IP 192.168.137.215.46516 > 192.168.137.1.12000: Flags [.], ack 4394, win 469, length 0
21:17:58.102331 IP 192.168.137.215.46516 > 192.168.137.1.12000: Flags [.], ack 5854, win 458, length 0
21:17:58.102349 IP 192.168.137.215.46516 > 192.168.137.1.12000: Flags [.], ack 7314, win 447, length 0
21:17:58.102371 IP 192.168.137.215.46516 > 192.168.137.1.12000: Flags [.], ack 8774, win 436, length 0
21:17:58.102402 IP 192.168.137.1.12000 > 192.168.137.215.46516: Flags [P.], seq 8774:10234, ack 10234, win 256, length 1460
21:17:58.102411 IP 192.168.137.1.12000 > 192.168.137.215.46516: Flags [.], ack 11694, win 256, length 0
21:17:58.102419 IP 192.168.137.1.12000 > 192.168.137.215.46516: Flags [P.], seq 10234:11694, ack 11694, win 256, length 1460
21:17:58.102422 IP 192.168.137.215.46516 > 192.168.137.1.12000: Flags [.], ack 10234, win 425, length 0
21:17:58.102427 IP 192.168.137.1.12000 > 192.168.137.215.46516: Flags [.], ack 13154, win 256, length 0
21:17:58.102434 IP 192.168.137.1.12000 > 192.168.137.215.46516: Flags [P.], seq 11694:13154, ack 13154, win 256, length 1460
21:17:58.102443 IP 192.168.137.1.12000 > 192.168.137.215.46516: Flags [.], ack 14614, win 256, length 0
21:17:58.102451 IP 192.168.137.1.12000 > 192.168.137.215.46516: Flags [P.], seq 13154:14601, ack 14614, win 256, length 1447
21:17:58.102459 IP 192.168.137.1.12000 > 192.168.137.215.46516: Flags [P.], seq 13154:14614, ack 14614, win 256, length 1460
21:17:58.102506 IP 192.168.137.215.46516 > 192.168.137.1.12000: Flags [.], ack 14601, win 391, length 0
21:17:58.119776 IP 192.168.137.1.12000 > 192.168.137.215.46516: Flags [P.], seq 14601:14614, ack 16074, win 256, length 13
21:17:58.119809 IP 192.168.137.215.46516 > 192.168.137.1.12000: Flags [.], ack 14614, win 501, options [nop,nop,sack 1 {14601:14614}], length 0
21:17:58.126671 IP 192.168.137.215.46516 > 192.168.137.1.12000: Flags [.], seq 21914:23374, ack 14614, win 501, length 1460
21:17:58.126707 IP 192.168.137.215.46516 > 192.168.137.1.12000: Flags [P.], seq 23374:24810, ack 14614, win 501, length 1436
21:17:58.130581 IP 192.168.137.1.12000 > 192.168.137.215.46516: Flags [.], ack 17534, win 256, length 0
21:17:58.140770 IP 192.168.137.1.12000 > 192.168.137.215.46516: Flags [.], ack 18994, win 256, length 0
21:17:58.159901 IP 192.168.137.1.12000 > 192.168.137.215.46516: Flags [P.], seq 14614:16074, ack 18994, win 256, length 1460
21:17:58.159923 IP 192.168.137.215.46516 > 192.168.137.1.12000: Flags [.], ack 16074, win 493, length 0
21:17:58.159937 IP 192.168.137.1.12000 > 192.168.137.215.46516: Flags [P.], seq 16074:17534, ack 18994, win 256, length 1460
21:17:58.159939 IP 192.168.137.1.12000 > 192.168.137.215.46516: Flags [.], ack 20454, win 256, length 0
21:17:58.159941 IP 192.168.137.1.12000 > 192.168.137.215.46516: Flags [.], ack 21914, win 256, length 0
21:17:58.159944 IP 192.168.137.215.46516 > 192.168.137.1.12000: Flags [.], ack 17534, win 482, length 0
21:17:58.162174 IP 192.168.137.1.12000 > 192.168.137.215.46516: Flags [P.], seq 17534:18994, ack 21914, win 256, length 1460
21:17:58.162211 IP 192.168.137.215.46516 > 192.168.137.1.12000: Flags [.], ack 18994, win 493, length 0
21:17:58.162228 IP 192.168.137.1.12000 > 192.168.137.215.46516: Flags [P.], seq 18994:20454, ack 21914, win 256, length 1460
21:17:58.162230 IP 192.168.137.1.12000 > 192.168.137.215.46516: Flags [P.], seq 20454:21914, ack 21914, win 256, length 1460
21:17:58.162238 IP 192.168.137.215.46516 > 192.168.137.1.12000: Flags [.], ack 20454, win 482, length 0
21:17:58.162247 IP 192.168.137.215.46516 > 192.168.137.1.12000: Flags [.], ack 21914, win 471, length 0
21:17:58.168363 IP 192.168.137.215.46516 > 192.168.137.1.12000: Flags [.], seq 24810:24834, ack 21914, win 501, length 24
21:17:58.168389 IP 192.168.137.215.46516 > 192.168.137.1.12000: Flags [.], seq 24834:26294, ack 21914, win 501, length 1460
21:17:58.168393 IP 192.168.137.215.46516 > 192.168.137.1.12000: Flags [P.], seq 26294:27754, ack 21914, win 501, length 1460
21:17:58.171838 IP 192.168.137.215.46516 > 192.168.137.1.12000: Flags [.], seq 27754:29214, ack 21914, win 501, length 1460
21:17:58.171848 IP 192.168.137.215.46516 > 192.168.137.1.12000: Flags [P.], seq 29214:30674, ack 21914, win 501, length 1460
21:17:58.175761 IP 192.168.137.1.12000 > 192.168.137.215.46516: Flags [.], ack 23374, win 256, length 0
21:17:58.175773 IP 192.168.137.1.12000 > 192.168.137.215.46516: Flags [P.], seq 21914:23374, ack 23374, win 256, length 1460
21:17:58.175788 IP 192.168.137.215.46516 > 192.168.137.1.12000: Flags [.], ack 23374, win 493, length 0
21:17:58.195775 IP 192.168.137.1.12000 > 192.168.137.215.46516: Flags [P.], seq 23374:24810, ack 24810, win 251, length 1436
21:17:58.195863 IP 192.168.137.215.46516 > 192.168.137.1.12000: Flags [.], ack 24810, win 493, length 0
21:17:58.203038 IP 192.168.137.215.46516 > 192.168.137.1.12000: Flags [FP.], seq 30674:30891, ack 24810, win 501, length 217
21:17:58.205540 IP 192.168.137.1.12000 > 192.168.137.215.46516: Flags [.], ack 24834, win 256, length 0
21:17:58.205574 IP 192.168.137.1.12000 > 192.168.137.215.46516: Flags [.], ack 26294, win 256, length 0
21:17:58.205584 IP 192.168.137.1.12000 > 192.168.137.215.46516: Flags [P.], seq 24810:26270, ack 26294, win 256, length 1460
21:17:58.205613 IP 192.168.137.1.12000 > 192.168.137.215.46516: Flags [P.], seq 26270:26294, ack 26294, win 256, length 24
21:17:58.205621 IP 192.168.137.1.12000 > 192.168.137.215.46516: Flags [.], ack 27754, win 256, length 0
21:17:58.205630 IP 192.168.137.1.12000 > 192.168.137.215.46516: Flags [P.], seq 26294:27754, ack 27754, win 256, length 1460
21:17:58.205637 IP 192.168.137.1.12000 > 192.168.137.215.46516: Flags [.], ack 29214, win 256, length 0
21:17:58.205644 IP 192.168.137.1.12000 > 192.168.137.215.46516: Flags [P.], seq 27754:29214, ack 29214, win 256, length 1460
21:17:58.205724 IP 192.168.137.215.46516 > 192.168.137.1.12000: Flags [.], ack 29214, win 493, length 0
21:17:58.206911 IP 192.168.137.1.12000 > 192.168.137.215.46516: Flags [.], ack 30674, win 256, length 0
21:17:58.206951 IP 192.168.137.1.12000 > 192.168.137.215.46516: Flags [P.], seq 29214:30674, ack 30674, win 256, length 1460
21:17:58.208342 IP 192.168.137.1.12000 > 192.168.137.215.46516: Flags [.], ack 30892, win 255, length 0
21:17:58.209723 IP 192.168.137.1.12000 > 192.168.137.215.46516: Flags [FP.], seq 30674:30891, ack 30892, win 255, length 217
21:17:58.209768 IP 192.168.137.215.46516 > 192.168.137.1.12000: Flags [.], ack 30892, win 493, length 0
