21:40:38.609521 IP 192.168.137.215.46620 > 192.168.137.1.12000: Flags [S], seq 74959961, win 64240, options [mss 1460,sackOK,TS val 594310142 ecr 0,nop,wscale 7], length 0
21:40:38.723125 IP 192.168.137.1.12000 > 192.168.137.215.46620: Flags [S.], seq 85677708, ack 74959962, win 65535, options [mss 1460,nop,wscale 8,nop,nop,sackOK], length 0
21:40:38.723204 IP 192.168.137.215.46620 > 192.168.137.1.12000: Flags [.], ack 1, win 502, length 0
21:40:38.723478 IP 192.168.137.215.46620 > 192.168.137.1.12000: Flags [.], seq 1:1461, ack 1, win 502, length 1460
21:40:38.723513 IP 192.168.137.215.46620 > 192.168.137.1.12000: Flags [P.], seq 1461:2921, ack 1, win 502, length 1460
21:40:38.723572 IP 192.168.137.215.46620 > 192.168.137.1.12000: Flags [.], seq 2921:4381, ack 1, win 502, length 1460
21:40:38.723584 IP 192.168.137.215.46620 > 192.168.137.1.12000: Flags [P.], seq 4381:5841, ack 1, win 502, length 1460
21:40:38.741462 IP 192.168.137.215.46620 > 192.168.137.1.12000: Flags [.], seq 5841:7301, ack 1, win 502, length 1460
21:40:38.741496 IP 192.168.137.215.46620 > 192.168.137.1.12000: Flags [P.], seq 7301:8761, ack 1, win 502, length 1460
21:40:38.787742 IP 192.168.137.215.46620 > 192.168.137.1.12000: Flags [.], seq 8761:10221, ack 1, win 502, length 1460
21:40:38.787752 IP 192.168.137.215.46620 > 192.168.137.1.12000: Flags [P.], seq 10221:11681, ack 1, win 502, length 1460
21:40:38.814635 IP 192.168.137.215.46620 > 192.168.137.1.12000: Flags [.], seq 11681:13141, ack 1, win 502, length 1460
21:40:38.814653 IP 192.168.137.215.46620 > 192.168.137.1.12000: Flags [P.], seq 13141:14601, ack 1, win 502, length 1460
21:40:38.857599 IP 192.168.137.1.12000 > 192.168.137.215.46620: Flags [P.], seq 1:1025, ack 1461, win 256, length 1024
21:40:38.857687 IP 192.168.137.215.46620 > 192.168.137.1.12000: Flags [.], seq 14601:16061, ack 1025, win 494, length 1460
21:40:38.857726 IP 192.168.137.215.46620 > 192.168.137.1.12000: Flags [P.], seq 16061:17521, ack 1025, win 494, length 1460
21:40:38.857748 IP 192.168.137.1.12000 > 192.168.137.215.46620: Flags [P.], seq 1025:1461, ack 2921, win 256, length 436
21:40:38.857778 IP 192.168.137.215.46620 > 192.168.137.1.12000: Flags [.], ack 1461, win 491, length 0
21:40:38.857791 IP 192.168.137.1.12000 > 192.168.137.215.46620: Flags [P.], seq 1461:2921, ack 2921, win 256, length 1460
21:40:38.857830 IP 192.168.137.215.46620 > 192.168.137.1.12000: Flags [.], ack 2921, win 480, length 0
21:40:38.879721 IP 192.168.137.215.46620 > 192.168.137.1.12000: Flags [.], seq 17521:18981, ack 2921, win 501, length 1460
21:40:38.879754 IP 192.168.137.215.46620 > 192.168.137.1.12000: Flags [P.], seq 18981:20441, ack 2921, win 501, length 1460
21:40:38.881217 IP 192.168.137.1.12000 > 192.168.137.215.46620: Flags [.], ack 4381, win 256, length 0
21:40:38.881258 IP 192.168.137.1.12000 > 192.168.137.215.46620: Flags [P.], seq 2921:4381, ack 4381, win 256, length 1460
21:40:38.881283 IP 192.168.137.215.46620 > 192.168.137.1.12000: Flags [.], ack 4381, win 493, length 0
21:40:38.881338 IP 192.168.137.1.12000 > 192.168.137.215.46620: Flags [.], ack 5841, win 256, length 0
21:40:38.881351 IP 192.168.137.1.12000 > 192.168.137.215.46620: Flags [P.], seq 4381:5841, ack 5841, win 256, length 1460
21:40:38.881362 IP 192.168.137.215.46620 > 192.168.137.1.12000: Flags [.], ack 5841, win 482, length 0
21:40:38.881376 IP 192.168.137.1.12000 > 192.168.137.215.46620: Flags [.], ack 7301, win 256, length 0
21:40:38.881385 IP 192.168.137.1.12000 > 192.168.137.215.46620: Flags [P.], seq 5841:7301, ack 7301, win 256, length 1460
21:40:38.881397 IP 192.168.137.215.46620 > 192.168.137.1.12000: Flags [.], ack 7301, win 471, length 0
21:40:38.881409 IP 192.168.137.1.12000 > 192.168.137.215.46620: Flags [.], ack 8761, win 256, length 0
21:40:38.881419 IP 192.168.137.1.12000 > 192.168.137.215.46620: Flags [P.], seq 7301:8761, ack 8761, win 256, length 1460
21:40:38.881429 IP 192.168.137.215.46620 > 192.168.137.1.12000: Flags [.], ack 8761, win 460, length 0
21:40:38.881485 IP 192.168.137.1.12000 > 192.168.137.215.46620: Flags [.], ack 10221, win 256, length 0
21:40:38.881497 IP 192.168.137.1.12000 > 192.168.137.215.46620: Flags [P.], seq 8761:10221, ack 10221, win 256, length 1460
21:40:38.881510 IP 192.168.137.215.46620 > 192.168.137.1.12000: Flags [.], ack 10221, win 458, length 0
21:40:38.881526 IP 192.168.137.1.12000 > 192.168.137.215.46620: Flags [.], ack 11681, win 256, length 0
21:40:38.881537 IP 192.168.137.1.12000 > 192.168.137.215.46620: Flags [P.], seq 10221:11681, ack 11681, win 256, length 1460
21:40:38.881549 IP 192.168.137.215.46620 > 192.168.137.1.12000: Flags [.], ack 11681, win 447, length 0
21:40:38.894747 IP 192.168.137.215.46620 > 192.168.137.1.12000: Flags [.], seq 20441:21901, ack 11681, win 501, length 1460
21:40:38.894781 IP 192.168.137.215.46620 > 192.168.137.1.12000: Flags [P.], seq 21901:23361, ack 11681, win 501, length 1460
21:40:38.921205 IP 192.168.137.215.46620 > 192.168.137.1.12000: Flags [.], seq 23361:24821, ack 11681, win 501, length 1460
21:40:38.921239 IP 192.168.137.215.46620 > 192.168.137.1.12000: Flags [P.], seq 24821:26281, ack 11681, win 501, length 1460
21:40:38.946683 IP 192.168.137.215.46620 > 192.168.137.1.12000: Flags [.], seq 26281:27741, ack 11681, win 501, length 1460
21:40:38.946712 IP 192.168.137.215.46620 > 192.168.137.1.12000: Flags [P.], seq 27741:29201, ack 11681, win 501, length 1460
21:40:38.948055 IP 192.168.137.1.12000 > 192.168.137.215.46620: Flags [.], ack 13141, win 256, length 0
21:40:38.948088 IP 192.168.137.1.12000 > 192.168.137.215.46620: Flags [P.], seq 11681:13141, ack 13141, win 256, length 1460
21:40:38.948119 IP 192.168.137.1.12000 > 192.168.137.215.46620: Flags [.], ack 14601, win 256, length 0
21:40:38.948131 IP 192.168.137.1.12000 > 192.168.137.215.46620: Flags [P.], seq 13141:14601, ack 14601, win 256, length 1460
21:40:38.948138 IP 192.168.137.1.12000 > 192.168.137.215.46620: Flags [.], ack 16061, win 256, length 0
21:40:38.948147 IP 192.168.137.1.12000 > 192.168.137.215.46620: Flags [P.], seq 14601:16061, ack 16061, win 256, length 1460
21:40:38.948153 IP 192.168.137.1.12000 > 192.168.137.215.46620: Flags [.], ack 17521, win 256, length 0
21:40:38.948163 IP 192.168.137.1.12000 > 192.168.137.215.46620: Flags [P.], seq 16061:17521, ack 17521, win 256, length 1460
21:40:38.948196 IP 192.168.137.1.12000 > 192.168.137.215.46620: Flags [.], ack 18981, win 256, length 0
21:40:38.948205 IP 192.168.137.1.12000 > 192.168.137.215.46620: Flags [P.], seq 17521:18981, ack 18981, win 256, length 1460
21:40:38.948262 IP 192.168.137.215.46620 > 192.168.137.1.12000: Flags [.], ack 18981, win 458, length 0
21:40:38.956384 IP 192.168.137.215.46620 > 192.168.137.1.12000: Flags [.], seq 29201:30661, ack 18981, win 501, length 1460
21:40:38.956414 IP 192.168.137.215.46620 > 192.168.137.1.12000: Flags [P.], seq 30661:32121, ack 18981, win 501, length 1460
21:40:38.959016 IP 192.168.137.215.46620 > 192.168.137.1.12000: Flags [.], seq 32121:33581, ack 18981, win 501, length 1460
21:40:38.959078 IP 192.168.137.215.46620 > 192.168.137.1.12000: Flags [.], seq 33581:35041, ack 18981, win 501, length 1460
21:40:38.959094 IP 192.168.137.215.46620 > 192.168.137.1.12000: Flags [P.], seq 35041:36501, ack 18981, win 501, length 1460
21:40:38.974373 IP 192.168.137.215.46620 > 192.168.137.1.12000: Flags [.], seq 36501:37961, ack 18981, win 501, length 1460
21:40:38.974408 IP 192.168.137.215.46620 > 192.168.137.1.12000: Flags [.], seq 37961:39421, ack 18981, win 501, length 1460
21:40:38.974419 IP 192.168.137.215.46620 > 192.168.137.1.12000: Flags [P.], seq 39421:40881, ack 18981, win 501, length 1460
21:40:38.977035 IP 192.168.137.1.12000 > 192.168.137.215.46620: Flags [.], ack 20441, win 256, length 0
21:40:38.977070 IP 192.168.137.1.12000 > 192.168.137.215.46620: Flags [P.], seq 18981:20441, ack 20441, win 256, length 1460
21:40:38.979682 IP 192.168.137.1.12000 > 192.168.137.215.46620: Flags [.], ack 20441, win 256, options [nop,nop,sack 1 {26281:27741}], length 0
21:40:38.979742 IP 192.168.137.215.46620 > 192.168.137.1.12000: Flags [.], seq 20441:21901, ack 20441, win 501, length 1460
21:40:38.979792 IP 192.168.137.1.12000 > 192.168.137.215.46620: Flags [.], ack 20441, win 256, options [nop,nop,sack 1 {26281:29201}], length 0
21:40:38.979813 IP 192.168.137.1.12000 > 192.168.137.215.46620: Flags [.], ack 20441, win 256, options [nop,nop,sack 1 {26281:30661}], length 0
21:40:38.979823 IP 192.168.137.1.12000 > 192.168.137.215.46620: Flags [.], ack 20441, win 256, options [nop,nop,sack 1 {26281:32121}], length 0
21:40:38.979834 IP 192.168.137.1.12000 > 192.168.137.215.46620: Flags [.], ack 20441, win 256, options [nop,nop,sack 1 {26281:33581}], length 0
21:40:38.999039 IP 192.168.137.215.46620 > 192.168.137.1.12000: Flags [.], seq 21901:23361, ack 20441, win 501, length 1460
21:40:39.007387 IP 192.168.137.1.12000 > 192.168.137.215.46620: Flags [.], ack 20441, win 256, options [nop,nop,sack 1 {26281:35041}], length 0
21:40:39.007446 IP 192.168.137.215.46620 > 192.168.137.1.12000: Flags [.], seq 23361:24821, ack 20441, win 501, length 1460
21:40:39.011496 IP 192.168.137.1.12000 > 192.168.137.215.46620: Flags [.], ack 20441, win 256, options [nop,nop,sack 1 {26281:36501}], length 0
21:40:39.011554 IP 192.168.137.215.46620 > 192.168.137.1.12000: Flags [.], seq 24821:26281, ack 20441, win 501, length 1460
21:40:39.011602 IP 192.168.137.1.12000 > 192.168.137.215.46620: Flags [.], ack 20441, win 256, options [nop,nop,sack 1 {26281:37961}], length 0
21:40:39.011620 IP 192.168.137.215.46620 > 192.168.137.1.12000: Flags [.], seq 40881:42341, ack 20441, win 501, length 1460
21:40:39.011634 IP 192.168.137.1.12000 > 192.168.137.215.46620: Flags [.], ack 20441, win 256, options [nop,nop,sack 1 {26281:39421}], length 0
21:40:39.011651 IP 192.168.137.215.46620 > 192.168.137.1.12000: Flags [.], seq 42341:43801, ack 20441, win 501, length 1460
21:40:39.011662 IP 192.168.137.1.12000 > 192.168.137.215.46620: Flags [.], ack 20441, win 256, options [nop,nop,sack 1 {26281:40881}], length 0
21:40:39.018777 IP 192.168.137.215.46620 > 192.168.137.1.12000: Flags [.], seq 43801:45261, ack 20441, win 501, length 1460
21:40:39.025364 IP 192.168.137.1.12000 > 192.168.137.215.46620: Flags [.], ack 21901, win 256, options [nop,nop,sack 1 {26281:40881}], length 0
21:40:39.025430 IP 192.168.137.215.46620 > 192.168.137.1.12000: Flags [.], seq 45261:46721, ack 20441, win 501, length 1460
21:40:39.025466 IP 192.168.137.215.46620 > 192.168.137.1.12000: Flags [P.], seq 46721:48181, ack 20441, win 501, length 1460
21:40:39.026214 IP 192.168.137.1.12000 > 192.168.137.215.46620: Flags [P.], seq 20441:21465, ack 21901, win 256, length 1024
21:40:39.026260 IP 192.168.137.1.12000 > 192.168.137.215.46620: Flags [.], ack 23361, win 256, options [nop,nop,sack 1 {26281:40881}], length 0
21:40:39.026290 IP 192.168.137.1.12000 > 192.168.137.215.46620: Flags [P.], seq 21465:21901, ack 23361, win 256, length 436
21:40:39.026298 IP 192.168.137.1.12000 > 192.168.137.215.46620: Flags [P.], seq 21901:23361, ack 23361, win 256, length 1460
21:40:39.026304 IP 192.168.137.1.12000 > 192.168.137.215.46620: Flags [.], ack 24821, win 256, options [nop,nop,sack 1 {26281:40881}], length 0
21:40:39.026315 IP 192.168.137.1.12000 > 192.168.137.215.46620: Flags [P.], seq 23361:24385, ack 24821, win 256, length 1024
21:40:39.026321 IP 192.168.137.1.12000 > 192.168.137.215.46620: Flags [.], ack 40881, win 256, length 0
21:40:39.026341 IP 192.168.137.1.12000 > 192.168.137.215.46620: Flags [P.], seq 24385:24821, ack 40881, win 256, length 436
21:40:39.026369 IP 192.168.137.1.12000 > 192.168.137.215.46620: Flags [P.], seq 24821:26281, ack 40881, win 256, length 1460
21:40:39.026418 IP 192.168.137.215.46620 > 192.168.137.1.12000: Flags [.], ack 24821, win 474, length 0
21:40:39.032594 IP 192.168.137.1.12000 > 192.168.137.215.46620: Flags [P.], seq 26281:26869, ack 40881, win 256, length 588
21:40:39.032634 IP 192.168.137.215.46620 > 192.168.137.1.12000: Flags [.], ack 26869, win 493, length 0
21:40:39.032696 IP 192.168.137.1.12000 > 192.168.137.215.46620: Flags [P.], seq 26869:28329, ack 40881, win 256, length 1460
21:40:39.032706 IP 192.168.137.1.12000 > 192.168.137.215.46620: Flags [P.], seq 28329:28917, ack 40881, win 256, length 588
21:40:39.032713 IP 192.168.137.1.12000 > 192.168.137.215.46620: Flags [P.], seq 28917:30377, ack 40881, win 256, length 1460
21:40:39.032719 IP 192.168.137.1.12000 > 192.168.137.215.46620: Flags [P.], seq 30377:30965, ack 40881, win 256, length 588
21:40:39.032724 IP 192.168.137.1.12000 > 192.168.137.215.46620: Flags [P.], seq 30965:32425, ack 40881, win 256, length 1460
21:40:39.032732 IP 192.168.137.1.12000 > 192.168.137.215.46620: Flags [P.], seq 32425:33013, ack 40881, win 256, length 588
21:40:39.032738 IP 192.168.137.1.12000 > 192.168.137.215.46620: Flags [P.], seq 33013:34473, ack 40881, win 256, length 1460
21:40:39.032785 IP 192.168.137.1.12000 > 192.168.137.215.46620: Flags [P.], seq 34473:35061, ack 40881, win 256, length 588
21:40:39.032799 IP 192.168.137.1.12000 > 192.168.137.215.46620: Flags [P.], seq 35061:36521, ack 40881, win 256, length 1460
21:40:39.032844 IP 192.168.137.215.46620 > 192.168.137.1.12000: Flags [.], ack 35061, win 429, length 0
21:40:39.037156 IP 192.168.137.215.46620 > 192.168.137.1.12000: Flags [.], seq 48181:49641, ack 36521, win 501, length 1460
21:40:39.037189 IP 192.168.137.215.46620 > 192.168.137.1.12000: Flags [P.], seq 49641:51101, ack 36521, win 501, length 1460
21:40:39.037283 IP 192.168.137.215.46620 > 192.168.137.1.12000: Flags [.], seq 51101:52561, ack 36521, win 501, length 1460
21:40:39.037295 IP 192.168.137.215.46620 > 192.168.137.1.12000: Flags [P.], seq 52561:54021, ack 36521, win 501, length 1460
21:40:39.043031 IP 192.168.137.1.12000 > 192.168.137.215.46620: Flags [P.], seq 36521:37109, ack 40881, win 256, length 588
21:40:39.043075 IP 192.168.137.1.12000 > 192.168.137.215.46620: Flags [P.], seq 37109:38569, ack 40881, win 256, length 1460
21:40:39.043083 IP 192.168.137.1.12000 > 192.168.137.215.46620: Flags [P.], seq 38569:39157, ack 40881, win 256, length 588
21:40:39.043090 IP 192.168.137.1.12000 > 192.168.137.215.46620: Flags [P.], seq 39157:40617, ack 40881, win 256, length 1460
21:40:39.043097 IP 192.168.137.1.12000 > 192.168.137.215.46620: Flags [P.], seq 40617:40881, ack 40881, win 256, length 264
21:40:39.043224 IP 192.168.137.215.46620 > 192.168.137.1.12000: Flags [.], ack 40881, win 493, length 0
21:40:39.057173 IP 192.168.137.215.46620 > 192.168.137.1.12000: Flags [.], seq 54021:55481, ack 40881, win 501, length 1460
21:40:39.057207 IP 192.168.137.215.46620 > 192.168.137.1.12000: Flags [P.], seq 55481:56941, ack 40881, win 501, length 1460
21:40:39.063036 IP 192.168.137.215.46620 > 192.168.137.1.12000: Flags [.], seq 56941:58401, ack 40881, win 501, length 1460
21:40:39.063070 IP 192.168.137.215.46620 > 192.168.137.1.12000: Flags [P.], seq 58401:59861, ack 40881, win 501, length 1460
21:40:39.070952 IP 192.168.137.215.46620 > 192.168.137.1.12000: Flags [.], seq 59861:61321, ack 40881, win 501, length 1460
21:40:39.070985 IP 192.168.137.215.46620 > 192.168.137.1.12000: Flags [P.], seq 61321:62781, ack 40881, win 501, length 1460
21:40:39.086010 IP 192.168.137.1.12000 > 192.168.137.215.46620: Flags [.], ack 42341, win 256, length 0
21:40:39.086072 IP 192.168.137.215.46620 > 192.168.137.1.12000: Flags [.], seq 62781:64241, ack 40881, win 501, length 1460
21:40:39.086112 IP 192.168.137.215.46620 > 192.168.137.1.12000: Flags [P.], seq 64241:65701, ack 40881, win 501, length 1460
21:40:39.086134 IP 192.168.137.1.12000 > 192.168.137.215.46620: Flags [P.], seq 40881:42341, ack 42341, win 256, length 1460
21:40:39.086168 IP 192.168.137.1.12000 > 192.168.137.215.46620: Flags [.], ack 43801, win 256, length 0
21:40:39.086180 IP 192.168.137.1.12000 > 192.168.137.215.46620: Flags [P.], seq 42341:43801, ack 43801, win 256, length 1460
21:40:39.086188 IP 192.168.137.1.12000 > 192.168.137.215.46620: Flags [.], ack 45261, win 256, length 0
21:40:39.086211 IP 192.168.137.215.46620 > 192.168.137.1.12000: Flags [.], seq 65701:67161, ack 43801, win 479, length 1460
21:40:39.086224 IP 192.168.137.215.46620 > 192.168.137.1.12000: Flags [P.], seq 67161:68621, ack 43801, win 479, length 1460
21:40:39.086237 IP 192.168.137.1.12000 > 192.168.137.215.46620: Flags [P.], seq 43801:45261, ack 45261, win 256, length 1460
21:40:39.086243 IP 192.168.137.1.12000 > 192.168.137.215.46620: Flags [.], ack 46721, win 256, length 0
21:40:39.086248 IP 192.168.137.1.12000 > 192.168.137.215.46620: Flags [P.], seq 45261:46721, ack 46721, win 256, length 1460
21:40:39.086286 IP 192.168.137.1.12000 > 192.168.137.215.46620: Flags [.], ack 48181, win 256, length 0
21:40:39.086300 IP 192.168.137.1.12000 > 192.168.137.215.46620: Flags [P.], seq 46721:48181, ack 48181, win 256, length 1460
21:40:39.086493 IP 192.168.137.215.46620 > 192.168.137.1.12000: Flags [.], ack 48181, win 461, length 0
21:40:39.092344 IP 192.168.137.215.46620 > 192.168.137.1.12000: Flags [.], seq 68621:70081, ack 48181, win 501, length 1460
21:40:39.092377 IP 192.168.137.215.46620 > 192.168.137.1.12000: Flags [P.], seq 70081:71541, ack 48181, win 501, length 1460
21:40:39.095973 IP 192.168.137.1.12000 > 192.168.137.215.46620: Flags [.], ack 49641, win 256, length 0
21:40:39.096004 IP 192.168.137.1.12000 > 192.168.137.215.46620: Flags [P.], seq 48181:49641, ack 49641, win 256, length 1460
21:40:39.096032 IP 192.168.137.1.12000 > 192.168.137.215.46620: Flags [.], ack 51101, win 256, length 0
21:40:39.096044 IP 192.168.137.1.12000 > 192.168.137.215.46620: Flags [P.], seq 49641:51101, ack 51101, win 256, length 1460
21:40:39.096051 IP 192.168.137.1.12000 > 192.168.137.215.46620: Flags [.], ack 52561, win 256, length 0
21:40:39.096058 IP 192.168.137.1.12000 > 192.168.137.215.46620: Flags [P.], seq 51101:52561, ack 52561, win 256, length 1460
21:40:39.096064 IP 192.168.137.1.12000 > 192.168.137.215.46620: Flags [.], ack 54021, win 256, length 0
21:40:39.096072 IP 192.168.137.1.12000 > 192.168.137.215.46620: Flags [P.], seq 52561:54021, ack 54021, win 256, length 1460
21:40:39.096141 IP 192.168.137.215.46620 > 192.168.137.1.12000: Flags [.], ack 54021, win 474, length 0
21:40:39.096147 IP 192.168.137.1.12000 > 192.168.137.215.46620: Flags [.], ack 55481, win 256, length 0
21:40:39.096157 IP 192.168.137.1.12000 > 192.168.137.215.46620: Flags [P.], seq 54021:55481, ack 55481, win 256, length 1460
21:40:39.096165 IP 192.168.137.1.12000 > 192.168.137.215.46620: Flags [.], ack 56941, win 256, length 0
21:40:39.096174 IP 192.168.137.1.12000 > 192.168.137.215.46620: Flags [P.], seq 55481:56941, ack 56941, win 256, length 1460
21:40:39.096181 IP 192.168.137.1.12000 > 192.168.137.215.46620: Flags [.], ack 58401, win 256, length 0
21:40:39.096188 IP 192.168.137.1.12000 > 192.168.137.215.46620: Flags [P.], seq 56941:58401, ack 58401, win 256, length 1460
21:40:39.096195 IP 192.168.137.1.12000 > 192.168.137.215.46620: Flags [.], ack 59861, win 256, length 0
21:40:39.096203 IP 192.168.137.1.12000 > 192.168.137.215.46620: Flags [P.], seq 58401:59861, ack 59861, win 256, length 1460
21:40:39.096225 IP 192.168.137.1.12000 > 192.168.137.215.46620: Flags [.], ack 61321, win 256, length 0
21:40:39.096314 IP 192.168.137.1.12000 > 192.168.137.215.46620: Flags [P.], seq 59861:61321, ack 61321, win 256, length 1460
21:40:39.096325 IP 192.168.137.1.12000 > 192.168.137.215.46620: Flags [.], ack 62781, win 256, length 0
21:40:39.096338 IP 192.168.137.1.12000 > 192.168.137.215.46620: Flags [P.], seq 61321:62781, ack 62781, win 256, length 1460
21:40:39.096440 IP 192.168.137.215.46620 > 192.168.137.1.12000: Flags [.], ack 62781, win 406, length 0
21:40:39.113203 IP 192.168.137.215.46620 > 192.168.137.1.12000: Flags [.], seq 71541:73001, ack 62781, win 501, length 1460
21:40:39.113262 IP 192.168.137.215.46620 > 192.168.137.1.12000: Flags [.], seq 73001:74461, ack 62781, win 501, length 1460
21:40:39.113275 IP 192.168.137.215.46620 > 192.168.137.1.12000: Flags [.], seq 74461:75921, ack 62781, win 501, length 1460
21:40:39.113284 IP 192.168.137.215.46620 > 192.168.137.1.12000: Flags [P.], seq 75921:77381, ack 62781, win 501, length 1460
21:40:39.116772 IP 192.168.137.215.46620 > 192.168.137.1.12000: Flags [.], seq 77381:78841, ack 62781, win 501, length 1460
21:40:39.116787 IP 192.168.137.215.46620 > 192.168.137.1.12000: Flags [.], seq 78841:80301, ack 62781, win 501, length 1460
21:40:39.116794 IP 192.168.137.215.46620 > 192.168.137.1.12000: Flags [P.], seq 80301:81761, ack 62781, win 501, length 1460
21:40:39.124215 IP 192.168.137.215.46620 > 192.168.137.1.12000: Flags [.], seq 81761:83221, ack 62781, win 501, length 1460
21:40:39.124230 IP 192.168.137.215.46620 > 192.168.137.1.12000: Flags [.], seq 83221:84681, ack 62781, win 501, length 1460
21:40:39.124234 IP 192.168.137.215.46620 > 192.168.137.1.12000: Flags [P.], seq 84681:86141, ack 62781, win 501, length 1460
21:40:39.145664 IP 192.168.137.1.12000 > 192.168.137.215.46620: Flags [.], ack 64241, win 256, length 0
21:40:39.145688 IP 192.168.137.215.46620 > 192.168.137.1.12000: Flags [.], seq 86141:87601, ack 62781, win 501, length 1460
21:40:39.145709 IP 192.168.137.1.12000 > 192.168.137.215.46620: Flags [P.], seq 62781:64241, ack 64241, win 256, length 1460
21:40:39.145722 IP 192.168.137.1.12000 > 192.168.137.215.46620: Flags [.], ack 65701, win 256, length 0
21:40:39.145730 IP 192.168.137.1.12000 > 192.168.137.215.46620: Flags [P.], seq 64241:65701, ack 65701, win 256, length 1460
21:40:39.145733 IP 192.168.137.1.12000 > 192.168.137.215.46620: Flags [.], ack 67161, win 256, length 0
21:40:39.145754 IP 192.168.137.1.12000 > 192.168.137.215.46620: Flags [P.], seq 65701:67161, ack 67161, win 256, length 1460
21:40:39.145758 IP 192.168.137.1.12000 > 192.168.137.215.46620: Flags [.], ack 68621, win 256, length 0
21:40:39.145769 IP 192.168.137.215.46620 > 192.168.137.1.12000: Flags [.], seq 87601:89061, ack 67161, win 467, length 1460
21:40:39.145775 IP 192.168.137.215.46620 > 192.168.137.1.12000: Flags [P.], seq 89061:90521, ack 67161, win 467, length 1460
21:40:39.145780 IP 192.168.137.1.12000 > 192.168.137.215.46620: Flags [P.], seq 67161:68621, ack 68621, win 256, length 1460
21:40:39.153525 IP 192.168.137.1.12000 > 192.168.137.215.46620: Flags [.], ack 70081, win 256, length 0
21:40:39.153555 IP 192.168.137.215.46620 > 192.168.137.1.12000: Flags [.], seq 90521:91981, ack 68621, win 524, length 1460
21:40:39.153572 IP 192.168.137.215.46620 > 192.168.137.1.12000: Flags [P.], seq 91981:93441, ack 68621, win 524, length 1460
21:40:39.153580 IP 192.168.137.1.12000 > 192.168.137.215.46620: Flags [P.], seq 68621:70081, ack 70081, win 256, length 1460
21:40:39.153594 IP 192.168.137.1.12000 > 192.168.137.215.46620: Flags [.], ack 71541, win 256, length 0
21:40:39.153599 IP 192.168.137.1.12000 > 192.168.137.215.46620: Flags [P.], seq 70081:71541, ack 71541, win 256, length 1460
21:40:39.153605 IP 192.168.137.215.46620 > 192.168.137.1.12000: Flags [.], ack 71541, win 570, length 0
21:40:39.153610 IP 192.168.137.1.12000 > 192.168.137.215.46620: Flags [.], ack 73001, win 256, length 0
21:40:39.153622 IP 192.168.137.215.46620 > 192.168.137.1.12000: Flags [.], seq 93441:94901, ack 71541, win 570, length 1460
21:40:39.153626 IP 192.168.137.215.46620 > 192.168.137.1.12000: Flags [.], seq 94901:96361, ack 71541, win 570, length 1460
21:40:39.153630 IP 192.168.137.215.46620 > 192.168.137.1.12000: Flags [P.], seq 96361:97821, ack 71541, win 570, length 1460
21:40:39.153636 IP 192.168.137.1.12000 > 192.168.137.215.46620: Flags [P.], seq 71541:73001, ack 73001, win 256, length 1460
21:40:39.153639 IP 192.168.137.1.12000 > 192.168.137.215.46620: Flags [.], ack 75921, win 256, length 0
21:40:39.153643 IP 192.168.137.1.12000 > 192.168.137.215.46620: Flags [P.], seq 73001:74461, ack 75921, win 256, length 1460
21:40:39.153647 IP 192.168.137.215.46620 > 192.168.137.1.12000: Flags [.], ack 74461, win 615, length 0
21:40:39.153684 IP 192.168.137.1.12000 > 192.168.137.215.46620: Flags [P.], seq 74461:75049, ack 75921, win 256, length 588
21:40:39.153689 IP 192.168.137.1.12000 > 192.168.137.215.46620: Flags [P.], seq 75049:75921, ack 78841, win 256, length 872
21:40:39.153698 IP 192.168.137.1.12000 > 192.168.137.215.46620: Flags [P.], seq 75921:77381, ack 78841, win 256, length 1460
21:40:39.153704 IP 192.168.137.215.46620 > 192.168.137.1.12000: Flags [.], ack 77381, win 684, length 0
21:40:39.153711 IP 192.168.137.1.12000 > 192.168.137.215.46620: Flags [P.], seq 77381:77969, ack 78841, win 256, length 588
21:40:39.153714 IP 192.168.137.1.12000 > 192.168.137.215.46620: Flags [P.], seq 77969:78841, ack 81761, win 256, length 872
21:40:39.153719 IP 192.168.137.1.12000 > 192.168.137.215.46620: Flags [P.], seq 78841:80301, ack 81761, win 256, length 1460
21:40:39.153727 IP 192.168.137.215.46620 > 192.168.137.1.12000: Flags [.], ack 80301, win 752, length 0
21:40:39.153736 IP 192.168.137.1.12000 > 192.168.137.215.46620: Flags [P.], seq 80301:80889, ack 81761, win 256, length 588
21:40:39.153744 IP 192.168.137.1.12000 > 192.168.137.215.46620: Flags [P.], seq 80889:81761, ack 84681, win 256, length 872
21:40:39.153780 IP 192.168.137.1.12000 > 192.168.137.215.46620: Flags [P.], seq 81761:83221, ack 84681, win 256, length 1460
21:40:39.153790 IP 192.168.137.215.46620 > 192.168.137.1.12000: Flags [.], ack 83221, win 820, length 0
21:40:39.153802 IP 192.168.137.1.12000 > 192.168.137.215.46620: Flags [P.], seq 83221:83809, ack 84681, win 256, length 588
21:40:39.153806 IP 192.168.137.1.12000 > 192.168.137.215.46620: Flags [P.], seq 83809:84681, ack 86141, win 256, length 872
21:40:39.153817 IP 192.168.137.1.12000 > 192.168.137.215.46620: Flags [P.], seq 84681:86141, ack 86141, win 256, length 1460
21:40:39.153826 IP 192.168.137.215.46620 > 192.168.137.1.12000: Flags [.], ack 86141, win 889, length 0
21:40:39.175372 IP 192.168.137.215.46620 > 192.168.137.1.12000: Flags [.], seq 97821:99281, ack 86141, win 889, length 1460
21:40:39.175406 IP 192.168.137.215.46620 > 192.168.137.1.12000: Flags [.], seq 99281:100741, ack 86141, win 889, length 1460
21:40:39.175418 IP 192.168.137.215.46620 > 192.168.137.1.12000: Flags [P.], seq 100741:102201, ack 86141, win 889, length 1460
21:40:39.179175 IP 192.168.137.215.46620 > 192.168.137.1.12000: Flags [.], seq 102201:103661, ack 86141, win 889, length 1460
21:40:39.179208 IP 192.168.137.215.46620 > 192.168.137.1.12000: Flags [P.], seq 103661:105121, ack 86141, win 889, length 1460
21:40:39.179241 IP 192.168.137.215.46620 > 192.168.137.1.12000: Flags [.], seq 105121:106581, ack 86141, win 889, length 1460
21:40:39.179251 IP 192.168.137.215.46620 > 192.168.137.1.12000: Flags [.], seq 106581:108041, ack 86141, win 889, length 1460
21:40:39.179261 IP 192.168.137.215.46620 > 192.168.137.1.12000: Flags [P.], seq 108041:109501, ack 86141, win 889, length 1460
21:40:39.180869 IP 192.168.137.1.12000 > 192.168.137.215.46620: Flags [.], ack 90521, win 256, length 0
21:40:39.180911 IP 192.168.137.1.12000 > 192.168.137.215.46620: Flags [P.], seq 86141:87601, ack 90521, win 256, length 1460
21:40:39.180941 IP 192.168.137.1.12000 > 192.168.137.215.46620: Flags [P.], seq 87601:88189, ack 90521, win 256, length 588
21:40:39.180964 IP 192.168.137.215.46620 > 192.168.137.1.12000: Flags [.], ack 88189, win 935, length 0
21:40:39.181004 IP 192.168.137.1.12000 > 192.168.137.215.46620: Flags [P.], seq 88189:89649, ack 90521, win 256, length 1460
21:40:39.181011 IP 192.168.137.1.12000 > 192.168.137.215.46620: Flags [P.], seq 89649:90237, ack 90521, win 256, length 588
21:40:39.181023 IP 192.168.137.215.46620 > 192.168.137.1.12000: Flags [.], ack 90237, win 980, length 0
21:40:39.184524 IP 192.168.137.1.12000 > 192.168.137.215.46620: Flags [P.], seq 90237:90521, ack 96361, win 256, length 284
21:40:39.184588 IP 192.168.137.1.12000 > 192.168.137.215.46620: Flags [P.], seq 90521:91981, ack 96361, win 256, length 1460
21:40:39.184612 IP 192.168.137.215.46620 > 192.168.137.1.12000: Flags [.], ack 91981, win 1026, length 0
21:40:39.184650 IP 192.168.137.1.12000 > 192.168.137.215.46620: Flags [P.], seq 91981:92569, ack 96361, win 256, length 588
21:40:39.184659 IP 192.168.137.1.12000 > 192.168.137.215.46620: Flags [P.], seq 92569:94029, ack 96361, win 256, length 1460
21:40:39.184670 IP 192.168.137.215.46620 > 192.168.137.1.12000: Flags [.], ack 94029, win 1071, length 0
21:40:39.184681 IP 192.168.137.1.12000 > 192.168.137.215.46620: Flags [P.], seq 94029:95489, ack 96361, win 256, length 1460
21:40:39.184688 IP 192.168.137.1.12000 > 192.168.137.215.46620: Flags [P.], seq 95489:95641, ack 96361, win 256, length 152
21:40:39.184695 IP 192.168.137.1.12000 > 192.168.137.215.46620: Flags [P.], seq 95641:96361, ack 102201, win 256, length 720
21:40:39.184702 IP 192.168.137.1.12000 > 192.168.137.215.46620: Flags [P.], seq 96361:97821, ack 102201, win 256, length 1460
21:40:39.184732 IP 192.168.137.215.46620 > 192.168.137.1.12000: Flags [.], ack 95641, win 1117, length 0
21:40:39.184781 IP 192.168.137.1.12000 > 192.168.137.215.46620: Flags [P.], seq 97821:99281, ack 102201, win 256, length 1460
21:40:39.184796 IP 192.168.137.1.12000 > 192.168.137.215.46620: Flags [P.], seq 99281:100457, ack 102201, win 256, length 1176
21:40:39.184805 IP 192.168.137.1.12000 > 192.168.137.215.46620: Flags [P.], seq 100457:101917, ack 102201, win 256, length 1460
21:40:39.184805 IP 192.168.137.215.46620 > 192.168.137.1.12000: Flags [.], ack 99281, win 1185, length 0
21:40:39.184815 IP 192.168.137.1.12000 > 192.168.137.215.46620: Flags [P.], seq 101917:102201, ack 102201, win 256, length 284
21:40:39.184829 IP 192.168.137.215.46620 > 192.168.137.1.12000: Flags [.], ack 101917, win 1231, length 0
21:40:39.187479 IP 192.168.137.215.46620 > 192.168.137.1.12000: Flags [.], seq 109501:110961, ack 102201, win 1254, length 1460
21:40:39.187512 IP 192.168.137.215.46620 > 192.168.137.1.12000: Flags [.], seq 110961:112421, ack 102201, win 1254, length 1460
21:40:39.187522 IP 192.168.137.215.46620 > 192.168.137.1.12000: Flags [P.], seq 112421:113881, ack 102201, win 1254, length 1460
21:40:39.187556 IP 192.168.137.215.46620 > 192.168.137.1.12000: Flags [.], seq 113881:115341, ack 102201, win 1254, length 1460
21:40:39.187566 IP 192.168.137.215.46620 > 192.168.137.1.12000: Flags [.], seq 115341:116801, ack 102201, win 1254, length 1460
21:40:39.187576 IP 192.168.137.215.46620 > 192.168.137.1.12000: Flags [.], seq 116801:118261, ack 102201, win 1254, length 1460
21:40:39.187585 IP 192.168.137.215.46620 > 192.168.137.1.12000: Flags [P.], seq 118261:119721, ack 102201, win 1254, length 1460
21:40:39.191460 IP 192.168.137.215.46620 > 192.168.137.1.12000: Flags [.], seq 119721:121181, ack 102201, win 1254, length 1460
21:40:39.191495 IP 192.168.137.215.46620 > 192.168.137.1.12000: Flags [.], seq 121181:122641, ack 102201, win 1254, length 1460
21:40:39.191506 IP 192.168.137.215.46620 > 192.168.137.1.12000: Flags [.], seq 122641:124101, ack 102201, win 1254, length 1460
21:40:39.191515 IP 192.168.137.215.46620 > 192.168.137.1.12000: Flags [P.], seq 124101:125561, ack 102201, win 1254, length 1460
21:40:39.193374 IP 192.168.137.215.46620 > 192.168.137.1.12000: Flags [.], seq 125561:127021, ack 102201, win 1254, length 1460
21:40:39.217624 IP 192.168.137.1.12000 > 192.168.137.215.46620: Flags [P.], seq 102201:103661, ack 109501, win 513, length 1460
21:40:39.217721 IP 192.168.137.215.46620 > 192.168.137.1.12000: Flags [.], seq 127021:128481, ack 103661, win 1277, length 1460
21:40:39.217759 IP 192.168.137.215.46620 > 192.168.137.1.12000: Flags [.], seq 128481:129941, ack 103661, win 1277, length 1460
21:40:39.217771 IP 192.168.137.215.46620 > 192.168.137.1.12000: Flags [.], seq 129941:131401, ack 103661, win 1277, length 1460
21:40:39.217781 IP 192.168.137.215.46620 > 192.168.137.1.12000: Flags [P.], seq 131401:132861, ack 103661, win 1277, length 1460
21:40:39.217802 IP 192.168.137.1.12000 > 192.168.137.215.46620: Flags [P.], seq 103661:104249, ack 109501, win 513, length 588
21:40:39.217813 IP 192.168.137.1.12000 > 192.168.137.215.46620: Flags [P.], seq 104249:105709, ack 109501, win 513, length 1460
21:40:39.217831 IP 192.168.137.215.46620 > 192.168.137.1.12000: Flags [.], ack 105709, win 1322, length 0
21:40:39.217843 IP 192.168.137.1.12000 > 192.168.137.215.46620: Flags [P.], seq 105709:106297, ack 109501, win 513, length 588
21:40:39.217851 IP 192.168.137.1.12000 > 192.168.137.215.46620: Flags [P.], seq 106297:107757, ack 109501, win 513, length 1460
21:40:39.217863 IP 192.168.137.215.46620 > 192.168.137.1.12000: Flags [.], ack 107757, win 1368, length 0
21:40:39.217874 IP 192.168.137.1.12000 > 192.168.137.215.46620: Flags [P.], seq 107757:108345, ack 109501, win 513, length 588
21:40:39.217881 IP 192.168.137.1.12000 > 192.168.137.215.46620: Flags [P.], seq 108345:109501, ack 119721, win 513, length 1156
21:40:39.217914 IP 192.168.137.215.46620 > 192.168.137.1.12000: Flags [.], seq 132861:134321, ack 109501, win 1414, length 1460
21:40:39.217937 IP 192.168.137.215.46620 > 192.168.137.1.12000: Flags [.], seq 134321:135781, ack 109501, win 1414, length 1460
21:40:39.217951 IP 192.168.137.215.46620 > 192.168.137.1.12000: Flags [P.], seq 135781:137241, ack 109501, win 1414, length 1460
21:40:39.217981 IP 192.168.137.1.12000 > 192.168.137.215.46620: Flags [P.], seq 109501:110961, ack 119721, win 513, length 1460
21:40:39.218105 IP 192.168.137.1.12000 > 192.168.137.215.46620: Flags [P.], seq 110961:112421, ack 119721, win 513, length 1460
21:40:39.218132 IP 192.168.137.215.46620 > 192.168.137.1.12000: Flags [.], ack 112421, win 1459, length 0
21:40:39.218160 IP 192.168.137.1.12000 > 192.168.137.215.46620: Flags [P.], seq 112421:113597, ack 119721, win 513, length 1176
21:40:39.218177 IP 192.168.137.1.12000 > 192.168.137.215.46620: Flags [P.], seq 113597:115057, ack 119721, win 513, length 1460
21:40:39.218200 IP 192.168.137.215.46620 > 192.168.137.1.12000: Flags [.], ack 115057, win 1505, length 0
21:40:39.218223 IP 192.168.137.1.12000 > 192.168.137.215.46620: Flags [P.], seq 115057:116517, ack 119721, win 513, length 1460
21:40:39.218234 IP 192.168.137.1.12000 > 192.168.137.215.46620: Flags [P.], seq 116517:116669, ack 119721, win 513, length 152
21:40:39.218244 IP 192.168.137.1.12000 > 192.168.137.215.46620: Flags [P.], seq 116669:118129, ack 119721, win 513, length 1460
21:40:39.218255 IP 192.168.137.1.12000 > 192.168.137.215.46620: Flags [P.], seq 118129:118717, ack 119721, win 513, length 588
21:40:39.218264 IP 192.168.137.1.12000 > 192.168.137.215.46620: Flags [P.], seq 118717:119721, ack 125561, win 513, length 1004
21:40:39.218288 IP 192.168.137.215.46620 > 192.168.137.1.12000: Flags [.], ack 116669, win 1550, length 0
21:40:39.218317 IP 192.168.137.1.12000 > 192.168.137.215.46620: Flags [P.], seq 119721:121181, ack 125561, win 513, length 1460
21:40:39.218356 IP 192.168.137.215.46620 > 192.168.137.1.12000: Flags [.], ack 118717, win 1596, length 0
21:40:39.218391 IP 192.168.137.215.46620 > 192.168.137.1.12000: Flags [.], ack 121181, win 1635, length 0
21:40:39.218688 IP 192.168.137.1.12000 > 192.168.137.215.46620: Flags [P.], seq 121181:121769, ack 125561, win 513, length 588
21:40:39.218734 IP 192.168.137.1.12000 > 192.168.137.215.46620: Flags [P.], seq 121769:123229, ack 125561, win 513, length 1460
21:40:39.218767 IP 192.168.137.215.46620 > 192.168.137.1.12000: Flags [.], ack 123229, win 1680, length 0
21:40:39.218808 IP 192.168.137.1.12000 > 192.168.137.215.46620: Flags [P.], seq 123229:123817, ack 125561, win 513, length 588
21:40:39.218819 IP 192.168.137.1.12000 > 192.168.137.215.46620: Flags [P.], seq 123817:125277, ack 125561, win 513, length 1460
21:40:39.218833 IP 192.168.137.215.46620 > 192.168.137.1.12000: Flags [.], ack 125277, win 1726, length 0
21:40:39.218847 IP 192.168.137.1.12000 > 192.168.137.215.46620: Flags [P.], seq 125277:125561, ack 125561, win 513, length 284
21:40:39.218853 IP 192.168.137.1.12000 > 192.168.137.215.46620: Flags [.], ack 127021, win 513, length 0
21:40:39.218872 IP 192.168.137.1.12000 > 192.168.137.215.46620: Flags [P.], seq 125561:127021, ack 127021, win 513, length 1460
21:40:39.218886 IP 192.168.137.215.46620 > 192.168.137.1.12000: Flags [.], ack 127021, win 1749, length 0
21:40:39.237818 IP 192.168.137.215.46620 > 192.168.137.1.12000: Flags [.], seq 137241:138701, ack 127021, win 1749, length 1460
21:40:39.237852 IP 192.168.137.215.46620 > 192.168.137.1.12000: Flags [.], seq 138701:140161, ack 127021, win 1749, length 1460
21:40:39.237863 IP 192.168.137.215.46620 > 192.168.137.1.12000: Flags [.], seq 140161:141621, ack 127021, win 1749, length 1460
21:40:39.237872 IP 192.168.137.215.46620 > 192.168.137.1.12000: Flags [P.], seq 141621:143081, ack 127021, win 1749, length 1460
21:40:39.237908 IP 192.168.137.215.46620 > 192.168.137.1.12000: Flags [.], seq 143081:144541, ack 127021, win 1749, length 1460
21:40:39.237918 IP 192.168.137.215.46620 > 192.168.137.1.12000: Flags [.], seq 144541:146001, ack 127021, win 1749, length 1460
21:40:39.237928 IP 192.168.137.215.46620 > 192.168.137.1.12000: Flags [.], seq 146001:147461, ack 127021, win 1749, length 1460
21:40:39.237937 IP 192.168.137.215.46620 > 192.168.137.1.12000: Flags [P.], seq 147461:148921, ack 127021, win 1749, length 1460
21:40:39.242280 IP 192.168.137.1.12000 > 192.168.137.215.46620: Flags [P.], seq 127021:128045, ack 137241, win 513, length 1024
21:40:39.242353 IP 192.168.137.1.12000 > 192.168.137.215.46620: Flags [P.], seq 128045:129505, ack 137241, win 513, length 1460
21:40:39.242379 IP 192.168.137.215.46620 > 192.168.137.1.12000: Flags [.], ack 129505, win 1794, length 0
21:40:39.242419 IP 192.168.137.1.12000 > 192.168.137.215.46620: Flags [P.], seq 129505:130965, ack 137241, win 513, length 1460
21:40:39.242427 IP 192.168.137.1.12000 > 192.168.137.215.46620: Flags [P.], seq 130965:132141, ack 137241, win 513, length 1176
21:40:39.242438 IP 192.168.137.215.46620 > 192.168.137.1.12000: Flags [.], ack 132141, win 1840, length 0
21:40:39.242450 IP 192.168.137.1.12000 > 192.168.137.215.46620: Flags [P.], seq 132141:133601, ack 137241, win 513, length 1460
21:40:39.242457 IP 192.168.137.1.12000 > 192.168.137.215.46620: Flags [P.], seq 133601:135061, ack 137241, win 513, length 1460
21:40:39.242463 IP 192.168.137.1.12000 > 192.168.137.215.46620: Flags [P.], seq 135061:135213, ack 137241, win 513, length 152
21:40:39.242470 IP 192.168.137.1.12000 > 192.168.137.215.46620: Flags [P.], seq 135213:136673, ack 137241, win 513, length 1460
21:40:39.242501 IP 192.168.137.215.46620 > 192.168.137.1.12000: Flags [.], ack 135061, win 1886, length 0
21:40:39.242519 IP 192.168.137.1.12000 > 192.168.137.215.46620: Flags [P.], seq 136673:137241, ack 137241, win 513, length 568
21:40:39.242552 IP 192.168.137.215.46620 > 192.168.137.1.12000: Flags [.], ack 137241, win 1917, length 0
21:40:39.248681 IP 192.168.137.215.46620 > 192.168.137.1.12000: Flags [.], seq 148921:150381, ack 137241, win 1917, length 1460
21:40:39.248720 IP 192.168.137.215.46620 > 192.168.137.1.12000: Flags [.], seq 150381:151841, ack 137241, win 1917, length 1460
21:40:39.248737 IP 192.168.137.215.46620 > 192.168.137.1.12000: Flags [.], seq 151841:153301, ack 137241, win 1917, length 1460
21:40:39.248752 IP 192.168.137.215.46620 > 192.168.137.1.12000: Flags [P.], seq 153301:154761, ack 137241, win 1917, length 1460
21:40:39.248800 IP 192.168.137.215.46620 > 192.168.137.1.12000: Flags [.], seq 154761:156221, ack 137241, win 1917, length 1460
21:40:39.248813 IP 192.168.137.215.46620 > 192.168.137.1.12000: Flags [.], seq 156221:157681, ack 137241, win 1917, length 1460
21:40:39.248822 IP 192.168.137.215.46620 > 192.168.137.1.12000: Flags [.], seq 157681:159141, ack 137241, win 1917, length 1460
21:40:39.248831 IP 192.168.137.215.46620 > 192.168.137.1.12000: Flags [P.], seq 159141:160601, ack 137241, win 1917, length 1460
